Course Title,Course Info,Course Rating,Course Duration,Course Level,Source,Course Info Translate,Course Title Translate
Supply Chain Principles,"Not specified Procurement, Supply Chain, Transporting Supply Chain Concepts, Planning & Procurement, Manufacturing & Service Operations, Warehousing Operations, Transportation Operations Business",4.6,12.0,Not applicable,Coursera,"Not specified Procurement, Supply Chain, Transporting Supply Chain Concepts, Planning & Procurement, Manufacturing & Service Operations, Warehousing Operations, Transportation Operations Business",Supply Chain Principles
Satisfaction Guaranteed: Develop Customer Loyalty Online,"Identify common strategies for building customer loyalty in e-commerceSuccessfully manage client relationships and measure satisfactionFind, apply for, and prepare for interviews and jobsPut together a portfolio and/or resume to present to employers Customer Relationship Management (CRM), Portfolio preparation, Building customer loyalty, E-commerce store optimization, Job preparedness Introduction to satisfaction guaranteed: develop customer loyalty online, Analyze trends for an online store, Prepare for jobs in digital marketing and e-commerce, Certificate review Business",4.8,27.0,Beginner,Coursera,"Identify common strategies for building customer loyalty in e-commerceSuccessfully manage client relationships and measure satisfactionFind, apply for, and prepare for interviews and jobsPut together a portfolio and/or resume to present to employers Customer Relationship Management (CRM), Portfolio preparation, Building customer loyalty, E-commerce store optimization, Job preparedness Introduction to satisfaction guaranteed: develop customer loyalty online, Analyze trends for an online store, Prepare for jobs in digital marketing and e-commerce, Certificate review Business",Satisfaction Guaranteed: Develop Customer Loyalty Online
The Principles of Real Estate,"Not specified goal setting, database management, Sphere of Influence, Lead Generation, Commissions The Job of a Real Estate Agent, How Real Estate Agents Get Paid, A Day in the Life of a Real Estate Agent, Be A Student of the Market, Real Estate is Lead Generation, Your Business is Your Database, Summary and Wrap-Up- The Principles of Real Estate Business",0.0,24.0,Beginner,Coursera,"Here is the translated text:

Goal setting, database management, Sphere of Influence, Lead Generation, Commissions The Job of a Real Estate Agent, How Real Estate Agents Get Paid, A Day in the Life of a Real Estate Agent, Be A Student of the Market, Real Estate is Lead Generation, Your Business is Your Database, Summary and Wrap-Up- The Principles of Real Estate Business",The Principles of Real Estate
Reporting extra-financier et stratégie RSE,"Not specified Not specified Les enjeux du reporting extra-financier, Qualifier ses impacts, Mesurer sa performance sociale et environnementale et en rendre compte, Les nouvelles frontières du reporting extra-financier Business",4.7,25.0,Beginner,Coursera,"The challenges of non-financial reporting, qualifying its impacts, measuring its social and environmental performance and reporting on it, the new frontiers of non-financial reporting Business",Non-financial reporting and CSR strategy
Finance for Technical Managers Specialization,"Articulate the principles and concepts of finance and financial management, particularly with your financial peers.Interpret a company’s financial statements, calculate financial health, and use metrics to evaluate the financial viability of a new project.Understand how capital budgeting processes work within a company, how to select projects, and how to plan for the financial future of a firm.Apply your knowledge to personal finance investments in stock and bond mutual funds. Project valuation, Financial Adviser, Discounted Cash Flow Analysis, Product Cost Analysis, financial statement analysis Product Cost and Investment Cash Flow Analysis , Project Valuation and the Capital Budgeting Process, Financial Forecasting and Reporting Business",4.6,40.0,Beginner,Coursera,"Articulate the principles and concepts of finance and financial management, particularly with your financial peers.Interpret a company’s financial statements, calculate financial health, and use metrics to evaluate the financial viability of a new project.Understand how capital budgeting processes work within a company, how to select projects, and how to plan for the financial future of a firm.Apply your knowledge to personal finance investments in stock and bond mutual funds. Project valuation, Financial Adviser, Discounted Cash Flow Analysis, Product Cost Analysis, financial statement analysis Product Cost and Investment Cash Flow Analysis , Project Valuation and the Capital Budgeting Process, Financial Forecasting and Reporting Business",Finance for Technical Managers Specialization
Introduction to Google SEO,"Critique the role of advertisements and corporate funding in the development of search  Compare and contrast the functionality of search engine algorithms updates  Write your own content for a website that will improve search results  Develop an optimization strategy following best practices for a client to implement to help increase their ranking   Search Algorithm, Search Engine Optimization (SEO), Mathematical Optimization, Semantics Introduction to Google SEO, Current SEO Best Practices, SEO of Today, Tomorrow and Beyond, Your Audience and Building Personas Business",4.6,13.0,Beginner,Coursera,"Critique the role of advertisements and corporate funding in the development of search  Compare and contrast the functionality of search engine algorithms updates  Write your own content for a website that will improve search results  Develop an optimization strategy following best practices for a client to implement to help increase their ranking   Search Algorithm, Search Engine Optimization (SEO), Mathematical Optimization, Semantics Introduction to Google SEO, Current SEO Best Practices, SEO of Today, Tomorrow and Beyond, Your Audience and Building Personas Business",Introduction to Google SEO
Entrepreneurship 1: Developing the Opportunity,"Not specified Discovery-Driven Planning, Elevator Pitch, Planning, Entrepreneurship Introduction and Course Materials, Module 1: Introduction to Entrepreneurship, Module 2: Opportunity Analysis, Module 3: Markets, Need-Finding and Planning, Module 4: Pitching, Testing, and Prototyping Business",4.8,10.0,Not applicable,Coursera,"Not specified Discovery-Driven Planning, Elevator Pitch, Planning, Entrepreneurship Introduction and Course Materials, Module 1: Introduction to Entrepreneurship, Module 2: Opportunity Analysis, Module 3: Markets, Need-Finding and Planning, Module 4: Pitching, Testing, and Prototyping Business",Entrepreneurship 1: Developing the Opportunity
Marketing en redes sociales de Meta Professional Certificate,"Crear y analizar una campaña publicitaria efectiva para tu público objetivo Crear un brief creativo que incluya los recursos de tu anuncio pagoCrear, editar y solucionar problemas de anuncios en el Administrador de anuncios de FacebookEstablecer y gestionar una presencia en redes sociales Marketing digital, Publicidad de rendimiento, Marketing en redes sociales, Gestión de marcas, Marketing de contenidos Introducción al marketing en redes sociales, Gestión de redes sociales, Fundamentos de la publicidad en redes sociales, Publicidad con Meta, Medir y optimizar campañas de marketing en redes sociales, Fase final de Marketing en redes sociales de Meta Business",4.9,80.0,Beginner,Coursera,"Create and analyze an effective advertising campaign for your target audience
Create a creative brief that includes the resources for your paid advertisement
Create, edit, and troubleshoot ads in Facebook Ads Manager
Establish and manage a presence on social media
Digital marketing, Performance advertising, Social media marketing, Brand management, Content marketing
Introduction to social media marketing, Social media management, Fundamentals of social media advertising, Advertising with Meta, Measure and optimize social media marketing campaigns, Final phase of Meta Business social media marketing.",Social media marketing Meta Professional Certificate
Coaching Skills for Managers Specialization,"Not specified Active Listening, Communication, Management, Coaching Managing as a Coach, Setting Expectations & Assessing Performance Issues, Coaching Practices, Coaching Conversations Business",4.7,80.0,Intermediate,Coursera,"Not specified Active Listening, Communication, Management, Coaching Managing as a Coach, Setting Expectations & Assessing Performance Issues, Coaching Practices, Coaching Conversations Business",Coaching Skills for Managers Specialization
"Negotiation, Mediation and Conflict Resolution Specialization","Not specified Communication, Negotiation, Planning, Cross-Cultural Communication Negotiation  Fundamentals, International and Cross-Cultural Negotiation, Mediation and Conflict Resolution, Negotiation, Mediation, and Conflict Resolution - Capstone Project Business",4.7,40.0,Beginner,Coursera,"Not specified Communication, Negotiation, Planning, Cross-Cultural Communication Negotiation  Fundamentals, International and Cross-Cultural Negotiation, Mediation and Conflict Resolution, Negotiation, Mediation, and Conflict Resolution - Capstone Project Business","Negotiation, Mediation and Conflict Resolution Specialization"
Climate Change and Sustainable Investing Specialization,"The science of climate changeThe economics of climate change The finance of climate change Learn to assess how climate change impacts financial portfolios and and how to manage climate risk in equity portfolios, Understand the various policy approaches involved in the transition to a low carbon economy including in particular ""cap & trade"" carbon markets, Understand how climate change risks impact corporate decisions and company value, Understanding the evidence for climate change and for its anthropogenic origin, Understand the instruments investment funds and solutions used to finance clean technologies and clean energy Science and Engineering of Climate Change, Economics and Policies of Climate Change, The Finance of Climate Change, Climate Aware Investing Business",4.7,40.0,Beginner,Coursera,"The science of climate changeThe economics of climate change The finance of climate change Learn to assess how climate change impacts financial portfolios and and how to manage climate risk in equity portfolios, Understand the various policy approaches involved in the transition to a low carbon economy including in particular ""cap & trade"" carbon markets, Understand how climate change risks impact corporate decisions and company value, Understanding the evidence for climate change and for its anthropogenic origin, Understand the instruments investment funds and solutions used to finance clean technologies and clean energy Science and Engineering of Climate Change, Economics and Policies of Climate Change, The Finance of Climate Change, Climate Aware Investing Business",Climate Change and Sustainable Investing Specialization
Strategy and Sustainability,"Not specified Not specified Course Overview & Week 1: Business & the Environment, Week 2 - Strategic Issues, Week 3 - Strategic Options, Week 4 - Environmental Interest Groups, Week 5 - Differences Across Industries and Around the World, Week 6 - How to develop a sustainability strategy Business",4.7,16.0,Beginner,Coursera,"Not specified Not specified Course Overview & Week 1: Business & the Environment, Week 2 - Strategic Issues, Week 3 - Strategic Options, Week 4 - Environmental Interest Groups, Week 5 - Differences Across Industries and Around the World, Week 6 - How to develop a sustainability strategy Business",Strategy and Sustainability
Arts and Heritage Management,"Not specified Fundraising, Customer Relationship Management (CRM), Management, Marketing CURATORSHIP Vs. MANAGEMENT, HERITAGE AND THE MARKETPLACE: A DELICATE EQUILIBRIUM, EMOTIONS Vs. RATIOS: HEDONIC CONSUMPTION AND THE ROLE OF EXPERIENCE, BRANDING HERITAGE TO BUILD LOYALTY, THE NUMBERS HERITAGE NEEDS TO GROW , MEET THE MANAGERS Business",4.8,16.0,Not applicable,Coursera,The text is already in English.,Arts and Heritage Management
Finanzas corporativas Specialization,"Not specified Mathematical Finance, Corporate Finance, Microsoft Excel, Finance Administración financiera y su función en la empresa , Matemáticas financieras, Evaluación de inversiones en Bienes de Capital , Estructura de capital y política de dividendos, Valuación de empresas , Toma de decisiones financieras Business",4.6,80.0,Intermediate,Coursera,"Not specified Mathematical Finance, Corporate Finance, Microsoft Excel, Finance Administración financiera y su función en la empresa , Matemáticas financieras, Evaluación de inversiones en Bienes de Capital , Estructura de capital y política de dividendos, Valuación de empresas , Toma de decisiones financieras Business",Finanzas corporativas Specialization
International Organizations Management ,"Not specified Not specified Welcome to the Course, Introduction to International Organizations, The Shifting Context for International Organizations, Leadership in the UN System, Public Private Partnerships, Marketing & Fundraising Business",4.8,17.0,Beginner,Coursera,"Not specified Not specified Welcome to the Course, Introduction to International Organizations, The Shifting Context for International Organizations, Leadership in the UN System, Public Private Partnerships, Marketing & Fundraising Business",International Organizations Management 
Social Media Marketing in Practice Specialization,"Not specified Build a personal brand on LinkedIn, Use social selling tactics to connect and engage with prospects, Use LinkedIn Campaign Manager to optimize B2B advertising campaigns, Set up a YouTube channel, Use Ads Manager to create and optimize Twitter ads, Build and sustain a social media community, Share and promote social content, Set up a social media experience for a business, Choose social media platforms and tools, Plan a social media advertising strategy, Digital Strategy, Social Media Marketing, Content Marketing, Digital Marketing, Digital transformation, Uncover campaign insights using native Facebook and Snapchat analytics tools, Use Snapchat Ad Manager to set up and optimize SnapAds, Set up advertising on Snapchat, Set up advertising on Facebook and Instagram, Use Facebook Ads Manager to create and optimize ad campaigns Social Media and Digital Marketing Fundamentals, Social Media and Social Content Strategy, Facebook, Instagram, and Snapchat Marketing, Twitter, LinkedIn, and YouTube Marketing Business",4.5,40.0,Beginner,Coursera,"Not specified Build a personal brand on LinkedIn, Use social selling tactics to connect and engage with prospects, Use LinkedIn Campaign Manager to optimize B2B advertising campaigns, Set up a YouTube channel, Use Ads Manager to create and optimize Twitter ads, Build and sustain a social media community, Share and promote social content, Set up a social media experience for a business, Choose social media platforms and tools, Plan a social media advertising strategy, Digital Strategy, Social Media Marketing, Content Marketing, Digital Marketing, Digital transformation, Uncover campaign insights using native Facebook and Snapchat analytics tools, Use Snapchat Ad Manager to set up and optimize SnapAds, Set up advertising on Snapchat, Set up advertising on Facebook and Instagram, Use Facebook Ads Manager to create and optimize ad campaigns Social Media and Digital Marketing Fundamentals, Social Media and Social Content Strategy, Facebook, Instagram, and Snapchat Marketing, Twitter, LinkedIn, and YouTube Marketing Business",Social Media Marketing in Practice Specialization
International Leadership and Organizational Behavior,"Not specified Social Network, Leadership, Management, Cross-Cultural Communication LEADERSHIP ACUMEN, NAVIGATING CULTURE, COMMUNICATING EFFECTIVELY, MOTIVATING FOLLOWERS, BUILDING PROFESSIONAL NETWORKS, MANAGING CONFLICTS Business",4.8,16.0,Not applicable,Coursera,"Not specified Social Network, Leadership, Management, Cross-Cultural Communication LEADERSHIP ACUMEN, NAVIGATING CULTURE, COMMUNICATING EFFECTIVELY, MOTIVATING FOLLOWERS, BUILDING PROFESSIONAL NETWORKS, MANAGING CONFLICTS Business",International Leadership and Organizational Behavior
Marketing digital e e-commerce do Google Professional Certificate,"Aprender os fundamentos do marketing digital e e-commerce para desenvolver as habilidades essenciais para uma vaga de trabalho de inicianteAtrair e engajar clientes por meio de canais de marketing digital, como busca e e-mailMedir os resultados de ações de marketing por meio de análises e insights presentesCriar lojas de e-commerce, analisar o desempenho on-line e aumentar a fidelidade do cliente E-Commerce, Email Marketing, Marketing, Otimização para mecanismos de busca (SEO), Publicidade gráfica Fundamentos do marketing digital e do e-commerce, Atrair e engajar clientes com marketing digital, De curtidas a leads: como interagir com os clientes on-line, Pense fora da caixa (de entrada): e-mail marketing, O sucesso por meio das avaliações: análise e medição de marketing, Faça a venda: crie, lance e gerencie lojas de e-commerce, Satisfação garantida: desenvolva a fidelidade de clientes Business",4.9,160.0,Beginner,Coursera,"Learn the fundamentals of digital marketing and e-commerce to develop essential skills for an entry-level job Attract and engage customers through digital marketing channels, such as search and email Measure the results of marketing actions through analysis and insights Create e-commerce stores, analyze online performance, and increase customer loyalty E-Commerce, Email Marketing, Marketing, Search Engine Optimization (SEO), Graphic Advertising Fundamentals of digital marketing and e-commerce, Attract and engage customers with digital marketing, From likes to leads: how to interact with customers online, Think outside the inbox: email marketing, Success through reviews: marketing analysis and measurement, Make the sale: create, launch, and manage e-commerce stores, Guaranteed satisfaction: develop customer loyalty Business",Digital marketing and e-commerce Google Professional Certificate
AI For Everyone （すべての人のためのAIリテラシー講座）,"Not specified Not specified AIの基礎, AI プロジェクトの推進, AIの社内導入と産業活用, AI と社会, 日本におけるAI活用 Business",4.7,7.0,Beginner,Coursera,"AI basics, AI project promotion, internal introduction and industrial utilization of AI, AI and society, AI utilization in Japan Business",AI For Everyone (AI Literacy Course for Everyone)
Learning and Development,"How to create and deliver effective trainings in your organizationHow to evaluate key metrics that will demonstrate training outcomes and results Learning Delivery Methods, Effective Training, Training Needs, Learning Models Introduction to Learning and Development, Structure and Design of Learning, Implementation and Evaluation of Training and Development, Learning Delivery, Application and Evaluation Business",4.7,15.0,Beginner,Coursera,"How to create and deliver effective trainings in your organization. How to evaluate key metrics that will demonstrate training outcomes and results. Learning Delivery Methods, Effective Training, Training Needs, Learning Models. Introduction to Learning and Development, Structure and Design of Learning, Implementation and Evaluation of Training and Development, Learning Delivery, Application and Evaluation Business.",Learning and Development
Financial Planning for Young Adults,"Not specified Risk Management, Budget, Saving, Investment Orientation, Module 1: Setting Financial Goals and Assessing Your Situation, Module 2: Budgeting and Cash Flow Management, Module 3: Saving Strategies, Module 4: The Time Value of Money, Module 5: Borrowing and Credit, Module 6: Investing, Module 7: Risk Management, Module 8: Financial Planning as a Career Business",4.6,20.0,Beginner,Coursera,"Not specified Risk Management, Budget, Saving, Investment Orientation, Module 1: Setting Financial Goals and Assessing Your Situation, Module 2: Budgeting and Cash Flow Management, Module 3: Saving Strategies, Module 4: The Time Value of Money, Module 5: Borrowing and Credit, Module 6: Investing, Module 7: Risk Management, Module 8: Financial Planning as a Career Business",Financial Planning for Young Adults
Digital Fashion Innovation Specialization,"Articulate a Digital Fashion Mindset Vision Statement while defining and summarizing digitalization in the fashion industry. Define your vision with a Digital Fashion Mission Statement and set goals to help you identify what you must do to achieve it.Craft a Digital Fashion Reality Manifesto that sets your intentions and outlines your place in the Digital Transformation of the fashion industry. Digital Transformation in Fashion, Digitalization in Fashion, Fashion Merchandising, Fashion E-Commerce, Digital Fashion Design Digital Fashion Mindset, Digital Fashion Industry, Digital Fashion Reality Business",4.6,40.0,Intermediate,Coursera,"Articulate a Digital Fashion Mindset Vision Statement while defining and summarizing digitalization in the fashion industry. Define your vision with a Digital Fashion Mission Statement and set goals to help you identify what you must do to achieve it.Craft a Digital Fashion Reality Manifesto that sets your intentions and outlines your place in the Digital Transformation of the fashion industry. Digital Transformation in Fashion, Digitalization in Fashion, Fashion Merchandising, Fashion E-Commerce, Digital Fashion Design Digital Fashion Mindset, Digital Fashion Industry, Digital Fashion Reality Business",Digital Fashion Innovation Specialization
International Marketing & Cross Industry Growth  Specialization,"Not specified Business Marketing, Sports Marketing, Marketing Intro to International Marketing, International Marketing Entry and Execution, International B2B (Business to Business) Marketing, International Hospitality & Healthcare Services Marketing, International Entertainment and Sports Marketing, International Marketing & Cross Industry Growth Capstone Project   Business",4.7,40.0,Beginner,Coursera,"Not specified Business Marketing, Sports Marketing, Marketing Intro to International Marketing, International Marketing Entry and Execution, International B2B (Business to Business) Marketing, International Hospitality & Healthcare Services Marketing, International Entertainment and Sports Marketing, International Marketing & Cross Industry Growth Capstone Project   Business",International Marketing & Cross Industry Growth  Specialization
Inspired Leadership Specialization,"Not specified Appreciative Inquiry, Negotiation, Leadership, Emotional Intelligence, Coaching Inspiring Leadership through Emotional Intelligence, Women in Leadership: Inspiring Positive Change, Conversations That Inspire: Coaching Learning, Leadership and Change, Leading Positive Change through Appreciative Inquiry, Be a Leader, Develop a Leader Business",4.8,80.0,Intermediate,Coursera,The text is already in English.,Inspired Leadership Specialization
Financial Acumen for Non-Financial Managers,"Not specified Not specified Module 1: Introduction, Balance Sheet and Income Statement, Module 2: Cash Flow Statement, Module 3: Financial Statement Analysis, Module 4: Linking Non-Financial Metrics to Financial Performance Business",4.5,8.0,Beginner,Coursera,"Not specified Not specified Module 1: Introduction, Balance Sheet and Income Statement, Module 2: Cash Flow Statement, Module 3: Financial Statement Analysis, Module 4: Linking Non-Financial Metrics to Financial Performance Business",Financial Acumen for Non-Financial Managers
What is Compliance?,"Define compliance within an industry settingDescribe the ways in which compliance affects any industry, company, or organizationIdentify the reasons industries, companies, and organizations should engage in complianceExamine the importance of compliance in supporting the financial, reputational, and functional aspects of an industry, company, or organization Risk Management, Compliance, Brand Management, Strategic Planning What is compliance?, Why is Compliance Important?, Compliance & Risk, Developments in the Field of Compliance Business",4.8,10.0,Not applicable,Coursera,"Define compliance within an industry settingDescribe the ways in which compliance affects any industry, company, or organizationIdentify the reasons industries, companies, and organizations should engage in complianceExamine the importance of compliance in supporting the financial, reputational, and functional aspects of an industry, company, or organization Risk Management, Compliance, Brand Management, Strategic Planning What is compliance?, Why is Compliance Important?, Compliance & Risk, Developments in the Field of Compliance Business",What is Compliance?
