Course Title,Course Info,Course Rating,Course Duration,Course Level,Source,Course Info Translate,Course Title Translate
Génie logiciel Specialization,"The principal tasks of software project managers.Software Engineering skill and techniques being used in Software Development Life Cycle (SDLC). Software Testing, Project Management, Software Engineering, Systems Design, Project Planning Software Engineering: Modeling Software Systems using UML, Software Engineering: Implementation and Testing, Software Engineering: Software Design and Project Management Computer Science",4.5,80.0,Intermediate,Coursera,"The principal tasks of software project managers.Software Engineering skill and techniques being used in Software Development Life Cycle (SDLC). Software Testing, Project Management, Software Engineering, Systems Design, Project Planning Software Engineering: Modeling Software Systems using UML, Software Engineering: Implementation and Testing, Software Engineering: Software Design and Project Management Computer Science",Software Engineering Specialization
Operations Research (1): Models and Applications,"Formulate different types of mathematical models to tackle optimization
problems with business applications. Technically, the concepts and applications
of Linear Programming, Integer Programming, and Nonlinear Programming will be delivered.Solve an optimization problem with one
of the most accessible software: Microsoft Excel.  Modeling, Business Analytics, Mathematical Optimization Course Overview, Linear Programming, Integer Programming, Nonlinear programming, Case Study: Personnel Scheduling, Course Summary and Future Directions Computer Science",4.8,11.0,Beginner,Coursera,"Formulate different types of mathematical models to tackle optimization
problems with business applications. Technically, the concepts and applications
of Linear Programming, Integer Programming, and Nonlinear Programming will be delivered.Solve an optimization problem with one
of the most accessible software: Microsoft Excel.  Modeling, Business Analytics, Mathematical Optimization Course Overview, Linear Programming, Integer Programming, Nonlinear programming, Case Study: Personnel Scheduling, Course Summary and Future Directions Computer Science",Operations Research (1): Models and Applications
Introduction to Data Analytics,"Explain what Data Analytics is and the key steps in the Data Analytics processDifferentiate between different data roles such as Data Engineer, Data Analyst, Data Scientist, Business Analyst, and Business Intelligence AnalystDescribe the different types of data structures, file formats, and sources of dataDescribe the data analysis process involving collecting, wrangling, mining, and visualizing data Data Science, Spreadsheet, Data Analysis, Microsoft Excel, Data Visualization What is Data Analytics, The Data Ecosystem, Gathering and Wrangling Data, Mining & Visualizing Data and Communicating Results, Career Opportunities and Data Analysis in Action Computer Science",4.8,10.0,Beginner,Coursera,"Explain what Data Analytics is and the key steps in the Data Analytics processDifferentiate between different data roles such as Data Engineer, Data Analyst, Data Scientist, Business Analyst, and Business Intelligence AnalystDescribe the different types of data structures, file formats, and sources of dataDescribe the data analysis process involving collecting, wrangling, mining, and visualizing data Data Science, Spreadsheet, Data Analysis, Microsoft Excel, Data Visualization What is Data Analytics, The Data Ecosystem, Gathering and Wrangling Data, Mining & Visualizing Data and Communicating Results, Career Opportunities and Data Analysis in Action Computer Science",Introduction to Data Analytics
Natural Language Processing Specialization,"Use logistic regression, naïve Bayes, and word vectors to implement sentiment analysis, complete analogies & translate words.Use dynamic programming, hidden Markov models, and word embeddings to implement autocorrect, autocomplete & identify part-of-speech tags for words.Use recurrent neural networks, LSTMs, GRUs & Siamese networks in Trax for sentiment analysis, text generation & named entity recognition.Use encoder-decoder, causal, & self-attention to machine translate complete sentences, summarize text, build chatbots & question-answering. Machine Translation, Transformers, Sentiment Analysis, Word2vec, Attention Models Natural Language Processing with Classification and Vector Spaces, Natural Language Processing with Probabilistic Models, Natural Language Processing with Sequence Models, Natural Language Processing with Attention Models Computer Science",4.6,120.0,Intermediate,Coursera,"Use logistic regression, naïve Bayes, and word vectors to implement sentiment analysis, complete analogies & translate words.Use dynamic programming, hidden Markov models, and word embeddings to implement autocorrect, autocomplete & identify part-of-speech tags for words.Use recurrent neural networks, LSTMs, GRUs & Siamese networks in Trax for sentiment analysis, text generation & named entity recognition.Use encoder-decoder, causal, & self-attention to machine translate complete sentences, summarize text, build chatbots & question-answering. Machine Translation, Transformers, Sentiment Analysis, Word2vec, Attention Models Natural Language Processing with Classification and Vector Spaces, Natural Language Processing with Probabilistic Models, Natural Language Processing with Sequence Models, Natural Language Processing with Attention Models Computer Science",Natural Language Processing Specialization
SAS Programmer Professional Certificate,"Understand and use the fundamentals of the SAS programming languageAccess different types of data (SAS, Excel, or text),      then explore and prepare the data Analyze and report on data and export results to common      formats (HTML, PDF, Excel)       Apply SAS programming principles in practical examples SAS Programs, Reports, Prepare Data, SAS Studio, Import Data Getting Started with SAS Programming, Doing More with SAS Programming, Preparing for the SAS Programming Certification Exam , Practicing for the SAS Programming Certification Exam Computer Science",4.8,80.0,Beginner,Coursera,"Understand and use the fundamentals of the SAS programming languageAccess different types of data (SAS, Excel, or text),      then explore and prepare the data Analyze and report on data and export results to common      formats (HTML, PDF, Excel)       Apply SAS programming principles in practical examples SAS Programs, Reports, Prepare Data, SAS Studio, Import Data Getting Started with SAS Programming, Doing More with SAS Programming, Preparing for the SAS Programming Certification Exam , Practicing for the SAS Programming Certification Exam Computer Science",SAS Programmer Professional Certificate
Applied Software Engineering Fundamentals Specialization,"Describe software development and related technologies; outline approaches to deployment architectures; and summarize career options in the field. Explain the role of version control and collaborative coding in SDLC & DevOps; Create GitHub repositories and use branching with Git commands.List and execute commonly used Linux commands, utilize pipes and redirection, create simple shell scripts using BASH, schedule jobs using Cron. Create, package, and deploy Python applications using knowledge of programming constructs, libraries, APIs and web services.  Software Design and Architecture, Python Programming, Git and GitHub, Software Development Lifecycle (SDLC), Linux Introduction to Software Engineering, Hands-on Introduction to Linux Commands and Shell Scripting, Getting Started with Git and GitHub, Python for Data Science, AI & Development, Developing AI Applications with Python and Flask Computer Science",4.7,80.0,Beginner,Coursera,"Describe software development and related technologies; outline approaches to deployment architectures; and summarize career options in the field. Explain the role of version control and collaborative coding in SDLC & DevOps; Create GitHub repositories and use branching with Git commands.List and execute commonly used Linux commands, utilize pipes and redirection, create simple shell scripts using BASH, schedule jobs using Cron. Create, package, and deploy Python applications using knowledge of programming constructs, libraries, APIs and web services.  Software Design and Architecture, Python Programming, Git and GitHub, Software Development Lifecycle (SDLC), Linux Introduction to Software Engineering, Hands-on Introduction to Linux Commands and Shell Scripting, Getting Started with Git and GitHub, Python for Data Science, AI & Development, Developing AI Applications with Python and Flask Computer Science",Applied Software Engineering Fundamentals Specialization
Information Technology (IT) and Cloud Fundamentals Specialization,"Operating systems history, installation, configuration, and hardware connectors and peripheral identification and troubleshooting techniques.Software management, cloud computing characteristics, benefits and trends, web browser essentials, software development basics, and database basics.Commonly used storage and network types, common security risks, and secure browsing practices.Application of technical and troubleshooting skills for an IT customer support role. Software Application Development, Computer Programming, Software Development Process, Database basics, IT Fundamentals, Technical Support, Operating Systems, Troubleshooting, hardware, Cybersecurity, Cryptography, Cyberattacks, Information Security (INFOSEC), Application Security, Cloud Computing, Hybrid Multicloud, Devops, Iaas PaaS Saas, Cloud Native, Certification Test, CompTIA ITF+, Cloud, Exam Practice, Wireless Networks, Network Troubleshooting, Network Architecture, Cloud Storage, Networking Hardware Introduction to Hardware and Operating Systems, Introduction to Software, Programming, and Databases , Introduction to Cloud Computing, Introduction to Networking and Storage, Introduction to Cybersecurity Essentials, Practice Exam for CompTIA ITF+ Certification Computer Science",4.8,80.0,Beginner,Coursera,"The text covers the history of operating systems, installation, configuration, hardware connectors, peripheral identification, and troubleshooting techniques. It also includes software management, characteristics of cloud computing, benefits and trends, essentials of web browsers, basics of software development, and database basics. Additionally, it discusses commonly used storage and network types, common security risks, and secure browsing practices. The application of technical and troubleshooting skills for an IT customer support role is also addressed. Other topics covered include software application development, computer programming, software development process, IT fundamentals, technical support, operating systems, troubleshooting, hardware, cybersecurity, cryptography, cyberattacks, information security, application security, cloud computing, hybrid multicloud, DevOps, IaaS, PaaS, SaaS, cloud native, certification tests, CompTIA ITF+, cloud, exam practice, wireless networks, network troubleshooting, network architecture, cloud storage, networking hardware, introduction to hardware and operating systems, introduction to software, programming, and databases, introduction to cloud computing, introduction to networking and storage, introduction to cybersecurity essentials, and practice exam for CompTIA ITF+ certification in computer science.",Information Technology (IT) and Cloud Fundamentals Specialization
IBM Data Engineering Professional Certificate,"Master the most up-to-date practical skills and knowledge data engineers use in their daily rolesLearn to create, design, & manage relational databases & apply database administration (DBA) concepts to RDBMSs such as MySQL, PostgreSQL, & IBM Db2 Develop working knowledge of NoSQL & Big Data using MongoDB, Cassandra, Cloudant, Hadoop, Apache Spark, Spark SQL, Spark ML, and Spark Streaming Implement ETL & Data Pipelines with Bash, Airflow & Kafka; architect, populate, deploy Data Warehouses; create BI reports & interactive dashboards  Data Science, Data Analysis, Python Programming, ETL & Data Pipelines, NoSQL and Big Data, SQL, Apache Spark, Database (DBMS), Relational Database Management Systems (RDBMS) Introduction to Data Engineering, Python for Data Science, AI & Development, Python Project for Data Engineering, Introduction to Relational Databases (RDBMS), Databases and SQL for Data Science with Python, Hands-on Introduction to Linux Commands and Shell Scripting, Relational Database Administration (DBA), ETL and Data Pipelines with Shell, Airflow and Kafka, Getting Started with Data Warehousing and BI Analytics, Introduction to NoSQL Databases, Introduction to Big Data with Spark and Hadoop, Machine Learning with Apache Spark, Data Engineering Capstone Project Computer Science",4.6,200.0,Beginner,Coursera,"Master the most up-to-date practical skills and knowledge data engineers use in their daily roles. Learn to create, design, & manage relational databases & apply database administration (DBA) concepts to RDBMSs such as MySQL, PostgreSQL, & IBM Db2. Develop working knowledge of NoSQL & Big Data using MongoDB, Cassandra, Cloudant, Hadoop, Apache Spark, Spark SQL, Spark ML, and Spark Streaming. Implement ETL & Data Pipelines with Bash, Airflow & Kafka; architect, populate, deploy Data Warehouses; create BI reports & interactive dashboards. Data Science, Data Analysis, Python Programming, ETL & Data Pipelines, NoSQL and Big Data, SQL, Apache Spark, Database (DBMS), Relational Database Management Systems (RDBMS). Introduction to Data Engineering, Python for Data Science, AI & Development, Python Project for Data Engineering, Introduction to Relational Databases (RDBMS), Databases and SQL for Data Science with Python, Hands-on Introduction to Linux Commands and Shell Scripting, Relational Database Administration (DBA), ETL and Data Pipelines with Shell, Airflow and Kafka, Getting Started with Data Warehousing and BI Analytics, Introduction to NoSQL Databases, Introduction to Big Data with Spark and Hadoop, Machine Learning with Apache Spark, Data Engineering Capstone Project Computer Science.",IBM Data Engineering Professional Certificate
Data Science Fundamentals with Python and SQL Specialization,"Working knowledge of Data Science Tools such as Jupyter Notebooks, R Studio, GitHub, Watson StudioPython programming basics including data structures, logic, working with files, invoking APIs, and libraries such as Pandas and NumpyStatistical Analysis techniques including  Descriptive Statistics, Data Visualization, Probability Distribution, Hypothesis Testing and RegressionRelational Database fundamentals including SQL query language, Select statements, sorting & filtering, database functions, accessing multiple tables Probability And Statistics, Basic Descriptive Statistics, Statistical Hypothesis Testing, Data Visualization, Regression Analysis, Data Science, Data Analysis, Python Programming, Numpy, Pandas, Jupyter notebooks, Cloud Databases, Relational Database Management System (RDBMS), SQL, Github, Rstudio Tools for Data Science, Python for Data Science, AI & Development, Python Project for Data Science, Statistics for Data Science with Python, Databases and SQL for Data Science with Python Computer Science",4.6,80.0,Beginner,Coursera,"Working knowledge of Data Science Tools such as Jupyter Notebooks, R Studio, GitHub, Watson StudioPython programming basics including data structures, logic, working with files, invoking APIs, and libraries such as Pandas and NumpyStatistical Analysis techniques including  Descriptive Statistics, Data Visualization, Probability Distribution, Hypothesis Testing and RegressionRelational Database fundamentals including SQL query language, Select statements, sorting & filtering, database functions, accessing multiple tables Probability And Statistics, Basic Descriptive Statistics, Statistical Hypothesis Testing, Data Visualization, Regression Analysis, Data Science, Data Analysis, Python Programming, Numpy, Pandas, Jupyter notebooks, Cloud Databases, Relational Database Management System (RDBMS), SQL, Github, Rstudio Tools for Data Science, Python for Data Science, AI & Development, Python Project for Data Science, Statistics for Data Science with Python, Databases and SQL for Data Science with Python Computer Science",Data Science Fundamentals with Python and SQL Specialization
Python Data Structures,"Explain the principles of data structures & how they are usedCreate programs that are able to read and write data from filesStore data as key/value pairs using Python dictionariesAccomplish multi-step tasks like sorting or looping using tuples Python Syntax And Semantics, Data Structure, Tuple, Python Programming Chapter Six: Strings, Unit: Installing and Using Python, Chapter Seven: Files, Chapter Eight: Lists, Chapter Nine: Dictionaries, Chapter Ten: Tuples, Graduation Computer Science",4.9,19.0,Beginner,Coursera,"Explain the principles of data structures and how they are used. Create programs that are able to read and write data from files. Store data as key/value pairs using Python dictionaries. Accomplish multi-step tasks like sorting or looping using tuples. Python Syntax and Semantics, Data Structure, Tuple, Python Programming. Chapter Six: Strings, Unit: Installing and Using Python, Chapter Seven: Files, Chapter Eight: Lists, Chapter Nine: Dictionaries, Chapter Ten: Tuples, Graduation Computer Science.",Python Data Structures
Cryptography I,"Not specified Cryptography, Cryptographic Attacks, Symmetric-Key Algorithm, Public-Key Cryptography Course overview and stream ciphers, Block Ciphers, Message Integrity, Authenticated Encryption, Basic Key Exchange, Public-Key Encryption, Final exam Computer Science",4.8,23.0,Not applicable,Coursera,The text is already in English.,Cryptography I
Computer Hardware and Software,"Identify the basic hardware components of a computer. Explain how software creates a functional and productive computer. Build a basic computer. Building Computers, Computer Software, Computer Hardware Hardware, Software, Networking and the Internet Computer Science",4.4,11.0,Beginner,Coursera,"Identify the basic hardware components of a computer. Explain how software creates a functional and productive computer. Build a basic computer. Building Computers, Computer Software, Computer Hardware Hardware, Software, Networking and the Internet Computer Science",Computer Hardware and Software
Basic Mathematics,"Apply the concept of trigonometry in real world problems.Solve a system of equations with the help of matrices.Understanding differentiation and integration with related applications.Understanding differential equations and solving first order and first degree differential equations. Not specified Course Introduction, Complex Numbers & Quadratic Equations, Trigonometry, Matrices, Differential Calculus with applications, Integral Calculus with Applications, Ordinary Differential Equations Computer Science",4.6,27.0,Beginner,Coursera,"Apply the concept of trigonometry in real world problems.Solve a system of equations with the help of matrices.Understanding differentiation and integration with related applications.Understanding differential equations and solving first order and first degree differential equations. Not specified Course Introduction, Complex Numbers & Quadratic Equations, Trigonometry, Matrices, Differential Calculus with applications, Integral Calculus with Applications, Ordinary Differential Equations Computer Science",Basic Mathematics
Web Applications for Everybody Specialization,"Installing your development environmentDeveloping a database application with PHP and MySQLUsing JavaScript to interact with a PHP web appModeling many-to-many relationships  Jquery, web application development, JavaScript, Hypertext Preprocessor (PHP), MySQL Building Web Applications in PHP, Introduction to Structured Query Language (SQL), Building Database Applications in PHP, JavaScript, jQuery, and JSON Computer Science",4.8,80.0,Intermediate,Coursera,"Installing your development environmentDeveloping a database application with PHP and MySQLUsing JavaScript to interact with a PHP web appModeling many-to-many relationships  Jquery, web application development, JavaScript, Hypertext Preprocessor (PHP), MySQL Building Web Applications in PHP, Introduction to Structured Query Language (SQL), Building Database Applications in PHP, JavaScript, jQuery, and JSON Computer Science",Web Applications for Everybody Specialization
Coding for Beginners: An Easy Introduction,"Create and execute a Python program using the IDE. Write and run code to display a phrase in several languages. Recognize programming concepts.  Computer Programming, Python Programming, Basic Coding, Programming Language, Basic programming concepts Learn step-by-step Computer Science",3.0,2.0,Beginner,Coursera,"Create and execute a Python program using the IDE. Write and run code to display a phrase in several languages. Recognize programming concepts.  Computer Programming, Python Programming, Basic Coding, Programming Language, Basic programming concepts Learn step-by-step Computer Science",Coding for Beginners: An Easy Introduction
"AI, Business & the Future of Work","How AI can give you better information upon which to make better decisions.How AI can help you automate processes and become more efficient.How AI will impact your industry so that you can avoid the pitfalls and seize the benefits. Not specified Introduction to AI in work and business, What AI can do, Risks with AI, AI and the future of work Computer Science",4.7,11.0,Beginner,Coursera,"How AI can give you better information upon which to make better decisions.How AI can help you automate processes and become more efficient.How AI will impact your industry so that you can avoid the pitfalls and seize the benefits. Not specified Introduction to AI in work and business, What AI can do, Risks with AI, AI and the future of work Computer Science","AI, Business & the Future of Work"
C++ Basics: Selection and Iteration,"Use variables and operators to store and manipulate small pieces of dataAutomate decision making using selection statements so the program result differs based on dataRepeat sections of your program using the appropriate loop type Computer Science, Iteration, C++, Conditionals, Variables Basic Skills - Writing your first program!, Operators, Conditionals, Loops Computer Science",4.6,8.0,Beginner,Coursera,"Utilice variables y operadores para almacenar y manipular pequeñas piezas de datos. Automatice la toma de decisiones utilizando declaraciones de selección para que el resultado del programa difiera según los datos. Repita secciones de su programa utilizando el tipo de bucle apropiado. Ciencias de la Computación, Iteración, C++, Condicionales, Variables. Habilidades básicas - Escribiendo su primer programa!, Operadores, Condicionales, Bucles. Ciencias de la Computación.",C++ Basics: Selection and Iteration
IBM Back-end JavaScript Developer Professional Certificate,"Not specified back-end development, Node.Js, JavaScript, Devops, express Introduction to Software Engineering, Introduction to HTML, CSS, & JavaScript, Getting Started with Git and GitHub, JavaScript Programming Essentials, Developing Back-End Apps with Node.js and Express, Get Started with Cloud Native, DevOps, Agile, and NoSQL, Introduction to Containers w/ Docker, Kubernetes & OpenShift, Application Development using Microservices and Serverless , Intermediate Back-end Development with Node and MongoDB, JavaScript Back-End Application Development Capstone Project, Software Developer Career Guide and Interview Preparation Computer Science",4.8,200.0,Beginner,Coursera,"Not specified back-end development, Node.Js, JavaScript, Devops, express Introduction to Software Engineering, Introduction to HTML, CSS, & JavaScript, Getting Started with Git and GitHub, JavaScript Programming Essentials, Developing Back-End Apps with Node.js and Express, Get Started with Cloud Native, DevOps, Agile, and NoSQL, Introduction to Containers w/ Docker, Kubernetes & OpenShift, Application Development using Microservices and Serverless , Intermediate Back-end Development with Node and MongoDB, JavaScript Back-End Application Development Capstone Project, Software Developer Career Guide and Interview Preparation Computer Science",IBM Back-end JavaScript Developer Professional Certificate
Introdução à Ciência da Computação com Python Parte 1,"Not specified Python Syntax And Semantics, Python Programming, Programming Language, Fundamental Concepts of Computer Science Apresentação e Introdução ao Curso, Introdução ao Python, Condicionais - if...else, Repetição - while, Funções, Depuração e refatoração, Repetições Encaixadas, Listas, Mais sobre listas Computer Science",4.9,42.0,Beginner,Coursera,"Not specified Python Syntax And Semantics, Python Programming, Programming Language, Fundamental Concepts of Computer Science Apresentação e Introdução ao Curso, Introdução ao Python, Condicionais - if...else, Repetição - while, Funções, Depuração e refatoração, Repetições Encaixadas, Listas, Mais sobre listas Computer Science",Introduction to Computer Science with Python Part 1
