Course Title,Course Info,Course Rating,Course Duration,Course Level,Source,Course Info Translate,Course Title Translate
Public Sector Efficiency: Optimizing Business Processes,"Comprehend the significance of Business Process Optimization in the public sector and its impact on service delivery and organizational performance.Utilize a structured framework to analyze and optimize existing business processes for increased efficiency and effectiveness.Apply best practices in planning and executing process improvements aligned with government or public sector organizational goals.Implement technology and automation to streamline workflows and enhance process efficiency. Organizational Performance, organizational skills, Business Process, Automation PUBLIC SECTOR EFFICIENCY - OPTIMIZING BUSINESS PROCESSES Business",0.0,2.0,Beginner,Coursera,"Comprehend the significance of Business Process Optimization in the public sector and its impact on service delivery and organizational performance.Utilize a structured framework to analyze and optimize existing business processes for increased efficiency and effectiveness.Apply best practices in planning and executing process improvements aligned with government or public sector organizational goals.Implement technology and automation to streamline workflows and enhance process efficiency. Organizational Performance, organizational skills, Business Process, Automation PUBLIC SECTOR EFFICIENCY - OPTIMIZING BUSINESS PROCESSES Business",Public Sector Efficiency: Optimizing Business Processes
Protecting Business Innovations via Strategy,"Not specified New Business Development, International Business Strategy, Business Strategy, Intellectual Property Resource based Strategy, Move Fast or Get Passed, E-Commerce Strategy, Changing the rules Business",4.7,11.0,Beginner,Coursera,The text is already in English.,Protecting Business Innovations via Strategy
Business Partner e o Papel dos Agentes na Gestão de RH,"Not specified Modelo de Business Partner, Liderança no modelo de Business Partner, Implementação do modelo de Business Partner Módulo 1 | Modelo de Business Partner, A Implementação e Desafios do Modelo de Business Partner, A Liderança no Modelo de Business Partner, Exemplificando o Alinhamento Estratégico de Práticas Específicas Business",4.7,26.0,Beginner,Coursera,"Not specified Business Partner model, Leadership in the Business Partner model, Implementation of the Business Partner model Module 1 | Business Partner model, Implementation and Challenges of the Business Partner model, Leadership in the Business Partner model, Exemplifying the Strategic Alignment of Specific Business Practices",Business Partner and the Role of Agents in HR Management
Create Content on Pinterest for Business,"Create Pinterest Business Account/Claim your Website.Create different types of Pins/Boards on PinterestShare Pinterest pins with others. Social Media Marketing, Marketing, Social Media Platforms, Business Strategy, Pinterest Learn step-by-step Business",0.0,1.0,Beginner,Coursera,"Create Pinterest Business Account/Claim your Website.Create different types of Pins/Boards on PinterestShare Pinterest pins with others. Social Media Marketing, Marketing, Social Media Platforms, Business Strategy, Pinterest Learn step-by-step Business",Create Content on Pinterest for Business
"Grow to Greatness: Smart Growth for Private Businesses, Part II","Different types of costs and how they are represented graphicallyCost-volume-profit analyses to answer questions around breaking even and generating profitHow to calculate and allocate overhead rates within both traditional and activity-based cost allocation systemsHow to distinguish costs and benefits that are relevant from those that are irrelevant for a given management decision Business Intelligence, Strategic Management, Innovation, Planning, Entrepreneurship Course Overview, The Entrepreneur Must Grow Too!, The Secret of High Performance is High Employee Engagement, Growth is Much More Than a Strategy—It Requires a System, Building a Senior Management Team, Final Exam Business",4.8,9.0,Not applicable,Coursera,"Different types of costs and how they are represented graphicallyCost-volume-profit analyses to answer questions around breaking even and generating profitHow to calculate and allocate overhead rates within both traditional and activity-based cost allocation systemsHow to distinguish costs and benefits that are relevant from those that are irrelevant for a given management decision Business Intelligence, Strategic Management, Innovation, Planning, Entrepreneurship Course Overview, The Entrepreneur Must Grow Too!, The Secret of High Performance is High Employee Engagement, Growth is Much More Than a Strategy—It Requires a System, Building a Senior Management Team, Final Exam Business","Grow to Greatness: Smart Growth for Private Businesses, Part II"
Action-Driven Business Plan: From the ‘Classroom’ to the World,"Not specified Not specified Welcome & Make a Plan, Zoom Out, Zoom In, Shape the Business Design - part 1, Shape the Business Design - part 2, Write a Business Plan Business",4.9,10.0,Not applicable,Coursera,"Not specified Not specified Welcome & Make a Plan, Zoom Out, Zoom In, Shape the Business Design - part 1, Shape the Business Design - part 2, Write a Business Plan Business",Action-Driven Business Plan: From the ‘Classroom’ to the World
How to optimize your Instagram Business Profile,"Create an attractive profile for your Instagram business account. Social Media Marketing, Marketing Strategy, Social Media Platforms Learn step-by-step Business",0.0,2.0,Beginner,Coursera,"Create an attractive profile for your Instagram business account. Social Media Marketing, Marketing Strategy, Social Media Platforms Learn step-by-step Business",How to optimize your Instagram Business Profile
طرق تقييم الشركات | Business Valuation Approaches,"Not specified معرفة Business & Accounting Analysis, التمكن من إجراء forecast of future benefits, تعلم كيفية اتخاذ القرار من خلال قائمة الـ financial statement طرق تقييم الشركات (Business Valuation Approaches) Business",0.0,1.0,Beginner,Coursera,"Not specified knowledge of Business & Accounting Analysis, proficiency in conducting forecast of future benefits, learning how to make decisions through financial statement analysis, methods of evaluating companies (Business Valuation Approaches) Business",Methods of evaluating companies | Business Valuation Approaches
Fundamentals of entrepreneurship in the family business,"Understand and apply best practices in the family businessDistinguish entrepreneurship and innovation modelsImplement entrepreneurship trends in your venture Not specified Topic 1. A Family Business Venture: The STEP Model, Topic 2. Mega Trends and Entrepreneurship, Topic 3. Ideation and Market Validation, Topic 4. Value Proposition, Topic 5. Business Pitch (Family and Non-Family Investors) Business",0.0,23.0,Expert,Coursera,"Understand and apply best practices in the family businessDistinguish entrepreneurship and innovation modelsImplement entrepreneurship trends in your venture Not specified Topic 1. A Family Business Venture: The STEP Model, Topic 2. Mega Trends and Entrepreneurship, Topic 3. Ideation and Market Validation, Topic 4. Value Proposition, Topic 5. Business Pitch (Family and Non-Family Investors) Business",Fundamentals of entrepreneurship in the family business
 Solving Business Problems with Spreadsheet Modeling,"Not specified Not specified Introduction to Capstone and Correlation Analysis, Sensitivity Analysis, Final Project Business",0.0,12.0,Not applicable,Coursera,"Not specified Not specified Introduction to Capstone and Correlation Analysis, Sensitivity Analysis, Final Project Business", Solving Business Problems with Spreadsheet Modeling
Business Process Outsourcing Strategies in Hospitality,"Explain the core concepts of BPO and its role in optimizing hospitality operations.Identify specific business processes in hospitality suitable for outsourcing to improve efficiency.Develop strategies for successful BPO implementation in hospitality businesses.Analyze potential challenges in hospitality BPO and apply best practices to overcome them. creative problem-solving, Process Optimization, Strategic Thinking, Effective Communication, Cultural Adaptation Fundamentals of BPO in Hospitality, Implementing BPO Strategies in Hospitality, Navigating BPO Challenges in Hospitality, Cultural Adaptation and the Future of BPO in Hospitality Business",0.0,9.0,Beginner,Coursera,"Explain the fundamental concepts of Business Process Outsourcing (BPO) and its importance in optimizing hospitality operations. Identify particular business processes within the hospitality industry that are suitable for outsourcing in order to enhance efficiency. Create strategies for successfully implementing BPO in hospitality businesses. Analyze potential challenges that may arise in hospitality BPO and apply best practices to overcome them, including creative problem-solving, process optimization, strategic thinking, effective communication, and cultural adaptation. Topics covered include the basics of BPO in hospitality, implementing BPO strategies in hospitality, navigating BPO challenges in hospitality, cultural adaptation, and the future of BPO in the hospitality industry.",Business Process Outsourcing Strategies in Hospitality
商管研究中的賽局分析（一）：通路選擇、合約制定與共享經濟 (Game Theoretic Analysis for Business Research (1)),"Not specified Not specified 課程概述與最佳化理論, 賽局理論簡介, 競爭環境中的通路選擇, 通路協作－退貨政策, 線上內置代銷連結：考慮品質異質性, 共享經濟中的平臺式快遞服務, 回顧、展望與隨想 Business",4.8,13.0,Beginner,Coursera,"Course Overview and Optimization Theory, Introduction to Game Theory, Channel Selection in Competitive Environments, Channel Collaboration - Return Policy, Online Embedded Agency Links: Considering Quality Heterogeneity, Platform-based Express Delivery Services in the Sharing Economy, Review, Prospects, and Reflections on Business","Game Theoretic Analysis in Business Research (1): Path Selection, Contract Formulation, and Sharing Economy"
Business Transformation with Google Cloud en Español,"Explain what cloud technology is and the top reasons the cloud era is revolutionizing business Craft an ideal transformation challenge for your organizationIdentify components of a security program to build into your transformation journeyBuild a business case and summary page for your overall transformation project using the templates provided Not specified Introducción, Módulo 1: Por qué la tecnología de nube está revolucionando los negocios, Módulo 2: Fomente una cultura de innovación, Módulo 3: Defina el desafío de transformación empresarial ideal, Módulo 4: Genere confianza con disponibilidad, seguridad y cumplimiento, Módulo 5: Crear un caso empresarial para su desafío de transformación, Conclusión Business",4.6,10.0,Beginner,Coursera,"Introduction, Module 1: Why cloud technology is revolutionizing business, Module 2: Foster a culture of innovation, Module 3: Define the ideal business transformation challenge, Module 4: Build trust with availability, security, and compliance, Module 5: Create a business case for your transformation challenge, Conclusion.",Business Transformation with Google Cloud in Spanish
How to Create a Facebook Business Manager Account,"Understand all the features in Facebook Business Manager.  Facebook, Facebook Business Manager Learn step-by-step Business",0.0,2.0,Beginner,Coursera,"Understand all the features in Facebook Business Manager.  Facebook, Facebook Business Manager Learn step-by-step Business",How to Create a Facebook Business Manager Account
Value and Business Decision Making,"How to make business decisions based on frameworks and modern tools Decision-Making, business acumen Module 1: The Need for, and the Value of, Social Business and the Complexity and the Challenges of Creating Them, Module 2: Overview of Specialization & Course, Decision Criteria - An Introduction, Decision Making - A Deeper Look, Cash Flows, Cash Flows - Applications Business",0.0,30.0,Beginner,Coursera,"How to make business decisions based on frameworks and modern tools Decision-Making, business acumen Module 1: The Need for, and the Value of, Social Business and the Complexity and the Challenges of Creating Them, Module 2: Overview of Specialization & Course, Decision Criteria - An Introduction, Decision Making - A Deeper Look, Cash Flows, Cash Flows - Applications Business",Value and Business Decision Making
Create a business profile on Twitter,"Create a profile for your business on TwitterSet up a profile for your business on Twitter Social Media Marketing, Twitter Learn step-by-step Business",0.0,1.0,Beginner,Coursera,"Create a profile for your business on TwitterSet up a profile for your business on Twitter Social Media Marketing, Twitter Learn step-by-step Business",Create a business profile on Twitter
Business Modeling Tools,"Not specified Microsoft Excel, Business Analytics, Business Case, Business Strategy Introduction to Business Modeling Tools, Introduction to Regression, Multivariate Regression, Regression Business Case Problem Business",0.0,10.0,Intermediate,Coursera,"Not specified Microsoft Excel, Business Analytics, Business Case, Business Strategy Introduction to Business Modeling Tools, Introduction to Regression, Multivariate Regression, Regression Business Case Problem Business",Business Modeling Tools
Create Business Growth Charts with Canva,"Create a line graph with Canva.Create a bar chart with Canva.Create a donut graph with Canva. Business, Canva, Charts, Finance, Graphic Design Learn step-by-step Business",0.0,2.0,Intermediate,Coursera,"Create a line graph with Canva.Create a bar chart with Canva.Create a donut graph with Canva. Business, Canva, Charts, Finance, Graphic Design Learn step-by-step Business",Create Business Growth Charts with Canva
Create Swag Bag Inserts to Market your Business using Canva,"Utilize efficient workflow strategies to develop a logo for a water bottle.Develop a minimal logo for a sportswear item.Prepare a design for print. Business, Digital Design, Marketing, Graphic Design Learn step-by-step Business",0.0,2.0,Expert,Coursera,"Utilize efficient workflow strategies to develop a logo for a water bottle.Develop a minimal logo for a sportswear item.Prepare a design for print. Business, Digital Design, Marketing, Graphic Design Learn step-by-step Business",Create Swag Bag Inserts to Market your Business using Canva
تقييم واستحواذ الشركات | Valuing and Acquiring a Business,"Not specified مهارات تقييم الشركات, مبادئ الإدارة, كيفية الاستحواذ على الشركات تقييم واستحواذ الشركات Business",0.0,1.0,Beginner,Coursera,"Not specified skills in company evaluation, principles of management, how to acquire companies evaluation and acquisition of companies Business",Valuing and Acquiring a Business
Using Twitter for Business and Twitter Analytics,"create advanced search on twittercreate data from twitter accounts Data Analysis, Data Reporting, Business, Business Analytics, data Learn step-by-step Business",0.0,2.0,Beginner,Coursera,"create advanced search on twittercreate data from twitter accounts Data Analysis, Data Reporting, Business, Business Analytics, data Learn step-by-step Business",Using Twitter for Business and Twitter Analytics
Create a Business Model Canvas in Miro,"Understand the purpose and process of creating a Business Model Canvas (BMC).Describe the nine components of the BMC in Miro. Develop the nine components and evaluate the BMC in Miro.  Strategic Communication, Value Proposition Design, User Experience Design (UXD), Business Model Canvas (BMC) Design, Channel Identification Learn step-by-step Business",0.0,2.0,Beginner,Coursera,"Understand the purpose and process of creating a Business Model Canvas (BMC).Describe the nine components of the BMC in Miro. Develop the nine components and evaluate the BMC in Miro.  Strategic Communication, Value Proposition Design, User Experience Design (UXD), Business Model Canvas (BMC) Design, Channel Identification Learn step-by-step Business",Create a Business Model Canvas in Miro
Business Transformation with Google Cloud auf Deutsch,"Explain what cloud technology is and the top reasons the cloud era is revolutionizing business Craft an ideal transformation challenge for your organizationIdentify components of a security program to build into your transformation journeyBuild a business case and summary page for your overall transformation project using the templates provided Not specified Einführung, Modul 1: Warum die Cloudtechnologie die Geschäftswelt revolutioniert, Modul 2: Die Innovationskultur fördern, Modul 3: Die ideale Herausforderung für die geschäftliche Transformation festlegen, Modul 4: Vertrauen durch Verfügbarkeit, Sicherheit und Compliance schaffen, Modul 5: Geschäftsszenario für Ihre Herausforderung zur Transformation entwickeln, Fazit Business",0.0,18.0,Beginner,Coursera,"Introduction, Module 1: Explain what cloud technology is and the top reasons the cloud era is revolutionizing business, Module 2: Foster an innovation culture, Module 3: Craft an ideal transformation challenge for your organization, Module 4: Build trust through availability, security, and compliance, Module 5: Develop a business scenario for your transformation challenge, Conclusion Business.",Business Transformation with Google Cloud in German
Capstone: Connected Planning for Business Transformation,"Not specified Business Planning, Technology Disruption, Strategic Planning, Business Strategy, Connected Planning Capstone Project: Connected Planning for Business Transformation Business",0.0,5.0,Beginner,Coursera,The text is already in English.,Capstone: Connected Planning for Business Transformation
Design Brainstorming diagrams for businesses with Creately,"You will be able to use Creately for free and discover its featuresYou will be able to create a Brainstorming diagram for free Team Building, Strategic Thinking, Brainstorming, Marketing Strategy, Creately Learn step-by-step Business",0.0,2.0,Beginner,Coursera,"You will be able to use Creately for free and discover its featuresYou will be able to create a Brainstorming diagram for free Team Building, Strategic Thinking, Brainstorming, Marketing Strategy, Creately Learn step-by-step Business",Design Brainstorming diagrams for businesses with Creately
Data Analysis for Business,"Not specified Business Analytics Introduction to Data Analysis, Organizing and Visualizing Data\u200b, Descriptive measures: univariate and bivariate\u200b, Statistical Inference\u200b, Regression Analysis\u200b Business",0.0,26.0,Intermediate,Coursera,"Not specified Business Analytics Introduction to Data Analysis, Organizing and Visualizing Data\u200b, Descriptive measures: univariate and bivariate\u200b, Statistical Inference\u200b, Regression Analysis\u200b Business",Data Analysis for Business
Business Transformation with Google Cloud 中文,"Explain what cloud technology is and the top reasons the cloud era is revolutionizing business Craft an ideal transformation challenge for your organizationIdentify components of a security program to build into your transformation journeyBuild a business case and summary page for your overall transformation project using the templates provided Business Transformation, Business Case, Business Strategy, Organizational Culture Introduction, 模块 1：为什么云技术正在彻底改变企业, 模块 2：培养创新文化, 模块 3：确定合适的企业转型挑战, 模块 4：通过可用性、安全性和合规性建立信任, 模块 5：针对您的转型挑战制作商业案例, 总结 Business",0.0,11.0,Beginner,Coursera,"Transformation, Business Case, Business Strategy, Organizational Culture Introduction, Module 1: Why Cloud Technology is Revolutionizing Business, Module 2: Cultivating an Innovative Culture, Module 3: Identifying the Right Business Transformation Challenge, Module 4: Building Trust through Availability, Security, and Compliance, Module 5: Creating a Business Case for Your Transformation Challenge, Summary Business.","Business Transformation with Google Cloud

In Chinese"
Business Transformation with Google Cloud 日本語版,"Explain what cloud technology is and the top reasons the cloud era is revolutionizing business Craft an ideal transformation challenge for your organizationIdentify components of a security program to build into your transformation journeyBuild a business case and summary page for your overall transformation project using the templates provided Business Transformation, Business Case Analysis, Business Strategy, Business Value, Organizational Culture はじめに, モジュール 1: クラウド テクノロジーがビジネスに革命を起こす理由\u3000, モジュール 2: イノベーション文化の醸成, モジュール 3: 理想的なビジネス変革の課題の定義, モジュール 4: 可用性、セキュリティ、コンプライアンスによる信頼の構築, モジュール 5: 変革の課題に対応するビジネスケースの作成, まとめ Business",0.0,10.0,Beginner,Coursera,"Introduction, Module 1: Reasons why cloud technology is revolutionizing business, Module 2: Cultivating an innovation culture, Module 3: Defining the ideal challenge for business transformation, Module 4: Building trust through availability, security, and compliance, Module 5: Creating a business case to address the challenges of transformation, Conclusion. Business Transformation, Business Case Analysis, Business Strategy, Business Value, Organizational Culture.",Business Transformation with Google Cloud Japanese Version
Creating a Budget in Libre Calc for a Small Business,"Access Libre Calc, understand why budgets are useful, and create a new spreadsheets with multiple tabs.Create organized budget, using formulas and data validation toolsCreate a graph. Spreadsheet creation Learn step-by-step Business",0.0,1.0,Intermediate,Coursera,"Access Libre Calc, understand why budgets are useful, and create a new spreadsheets with multiple tabs.Create organized budget, using formulas and data validation toolsCreate a graph. Spreadsheet creation Learn step-by-step Business",Creating a Budget in Libre Calc for a Small Business
Business Transformation with Google Cloud en Français,"Explain what cloud technology is and the top reasons the cloud era is revolutionizing business Craft an ideal transformation challenge for your organizationIdentify components of a security program to build into your transformation journeyBuild a business case and summary page for your overall transformation project using the templates provided Not specified Introduction, Module 1 : Pourquoi la technologie cloud révolutionne-t-elle les pratiques métier ?, ""Module 2 : Encourager une culture de linnovation"", ""Module 3 : Définir le défi de transformation dentreprise idéal"", Module\xa04\xa0: Forger la confiance grâce à la disponibilité, à la sécurité et à la conformité, Module 5 : Réaliser une étude de cas pour votre défi de transformation, Conclusion Business",0.0,10.0,Beginner,Coursera,"Module 1: Why is cloud technology revolutionizing business practices?, Module 2: Encouraging a culture of innovation, Module 3: Defining the ideal business transformation challenge, Module 4: Building trust through availability, security, and compliance, Module 5: Conducting a case study for your transformation challenge, Conclusion Business.",Business Transformation with Google Cloud in French
Business Transformation with Google Cloud em Português ,"Explain what cloud technology is and the top reasons the cloud era is revolutionizing business Craft an ideal transformation challenge for your organizationIdentify components of a security program to build into your transformation journeyBuild a business case and summary page for your overall transformation project using the templates provided Not specified Introdução, Módulo 1: Por que a tecnologia de nuvem está revolucionando os negócios, Módulo 2: Promover uma cultura de inovação, Módulo 3: Definir o desafio ideal da transformação dos negócios, Módulo 4: Criar confiança com disponibilidade, segurança e conformidade, Módulo 5: Criar um caso de negócios para seu desafio de transformação, Conclusão Business",4.9,10.0,Beginner,Coursera,"Introduction, Module 1: Why cloud technology is revolutionizing business, Module 2: Promoting a culture of innovation, Module 3: Defining the ideal business transformation challenge, Module 4: Building trust with availability, security, and compliance, Module 5: Creating a business case for your transformation challenge, Conclusion.",Business Transformation with Google Cloud in Portuguese
Get Started with Facebook Business Manager ,"Get started with Facebook Business Manager Facebook, Business Manager Learn step-by-step Business",0.0,2.0,Beginner,Coursera,"Get started with Facebook Business Manager Facebook, Business Manager Learn step-by-step Business",Get Started with Facebook Business Manager 
