Course Title,Course Info,Course Rating,Course Duration,Course Level,Source,Course Info Translate,Course Title Translate
当代应用心理学,"Not specified Not specified 第一章 心理学原理概述, 第二章 人因心理学原理简介及实例探讨,  第三章 消费者心理学原理简介及实例探讨, 第四章 组织及领导心理学原理简介及实例探讨, 第五章 性格心理学原理简介及实例探讨, 第六章 法律与犯罪心理学原理简介及实例探讨,  第七章 身心健康与适应心理原理简介及实例探讨, 第八章 心理测验与个别特质差异的原理简介及实例探讨, 第九章 人际与职场心理的原理简介及实例探讨 Health",4.6,28.0,Not applicable,Coursera,"Chapter One: Overview of Psychological Principles
Chapter Two: Introduction and Discussion of Human Factors Psychology Principles with Examples
Chapter Three: Introduction and Discussion of Consumer Psychology Principles with Examples
Chapter Four: Introduction and Discussion of Organizational and Leadership Psychology Principles with Examples
Chapter Five: Introduction and Discussion of Personality Psychology Principles with Examples
Chapter Six: Introduction and Discussion of Legal and Criminal Psychology Principles with Examples
Chapter Seven: Introduction and Discussion of Principles of Physical and Mental Health and Adaptation Psychology with Examples
Chapter Eight: Introduction and Discussion of Principles of Psychological Testing and Individual Trait Differences with Examples
Chapter Nine: Introduction and Discussion of Principles of Interpersonal and Workplace Psychology with Examples",Contemporary applied psychology
Evaluación del Aprendizaje en Escenarios Clínicos,"Not specified Evaluación, Observación, Comparación, Síntesis, Análisis Tema 1. Educación médica y evaluación, Tema 2. Evaluación de la competencia clínica centrada en el paciente, Tema 3. Calidad de la Evaluación en escenarios clínicos, Tema 4. El papel de la realimentación en la evaluación clínica Health",4.8,43.0,Intermediate,Coursera,"Not specified Evaluation, Observation, Comparison, Synthesis, Analysis Topic 1. Medical education and evaluation, Topic 2. Evaluation of patient-centered clinical competence, Topic 3. Quality of evaluation in clinical settings, Topic 4. The role of feedback in clinical evaluation Health",Assessment of Learning in Clinical Scenarios
Calidad en la atención clínica,"Not specified Trabajo en Equipo, Mejora continua, Liderazgo, satisfacción del cliente, Calidad en el servicio Calidad en el servicio, Importancia de la atención interprofesional, Desarrollo Profesional Continuo, Escenarios y Ambientes educativos Health",0.0,22.0,Beginner,Coursera,"Teamwork, Continuous Improvement, Leadership, Customer Satisfaction, Quality in Service, Importance of Interprofessional Care, Continuous Professional Development, Educational Scenarios and Environments, Health.",Quality in clinical care
Better Learning,"Identify the shortcomings of your current study habits to improve the way you use notes, highlighting, flashcards, and other classic study tools.Learn to use scientifically validated learning techniques to improve your studying and increase your retention.Create effective plans to overcome procrastination Metacognition, Understanding Memory, Defeating Procrastination, Learning Strategies, Improving Learning Learn With PsycLearn Essentials, Module 1: Why You Need This Course, Module 2: The Ins and Outs of Memory, Module 3: Elaboration, Module 4: Focused Learning, Module 5: Spaced Learning, Module 6: Retrieval Practice, Module 7: How to Be a Better Learner, Module 8: Course Summary, Module 9: Cumulative Quiz, Module 10: Course Resources, PsycLearn Essentials APA Student Resources Health",0.0,16.0,Beginner,Coursera,"Identify the shortcomings of your current study habits to improve the way you use notes, highlighting, flashcards, and other classic study tools.Learn to use scientifically validated learning techniques to improve your studying and increase your retention.Create effective plans to overcome procrastination Metacognition, Understanding Memory, Defeating Procrastination, Learning Strategies, Improving Learning Learn With PsycLearn Essentials, Module 1: Why You Need This Course, Module 2: The Ins and Outs of Memory, Module 3: Elaboration, Module 4: Focused Learning, Module 5: Spaced Learning, Module 6: Retrieval Practice, Module 7: How to Be a Better Learner, Module 8: Course Summary, Module 9: Cumulative Quiz, Module 10: Course Resources, PsycLearn Essentials APA Student Resources Health",Better Learning
Science Matters: Let's Talk About COVID-19,"To be aware of the scale of the emerging outbreak and know how to track trends using reliable sources of informationTo recognise the key scientific underpinnings of evidence-based outbreak control methodsTo recognise the importance of community involvement, multidisciplinary working and global cooperation in outbreak responseAbout how infectious disease modelling informs strategic and operational response at the local, national, and international level. Not specified ""Introduction to Science Matters: Lets talk about COVID-19"", COVID-19 Situation Reports: Updates on the Ongoing State of the Epidemic, How to Forecast an Epidemic: Epidemiology and Infectious Disease Modelling, Health Systems and Economic Impacts, Community Engagement and Response, The Virology of COVID-19, The Clinical Presentations of COVID-19, Summary Module Health",4.2,17.0,Beginner,Coursera,"To be aware of the scale of the emerging outbreak and know how to track trends using reliable sources of informationTo recognise the key scientific underpinnings of evidence-based outbreak control methodsTo recognise the importance of community involvement, multidisciplinary working and global cooperation in outbreak responseAbout how infectious disease modelling informs strategic and operational response at the local, national, and international level. Not specified ""Introduction to Science Matters: Lets talk about COVID-19"", COVID-19 Situation Reports: Updates on the Ongoing State of the Epidemic, How to Forecast an Epidemic: Epidemiology and Infectious Disease Modelling, Health Systems and Economic Impacts, Community Engagement and Response, The Virology of COVID-19, The Clinical Presentations of COVID-19, Summary Module Health",Science Matters: Let's Talk About COVID-19
Palliative Care Capstone Projects,"Not specified Not specified Nature of Suffering Capstone Project, SNAP and Self-Awareness Capstone Project, Easing Pain Capstone Project, Easing Physical Symptoms Capstone Project, Advance Care Planning Capstone Project Health",4.8,23.0,Beginner,Coursera,The text is already in English.,Palliative Care Capstone Projects
生物信息学: 导论与方法,"Not specified Not specified 导论与历史, 序列比对, 序列数据库搜索, 马尔可夫模型, 新一代测序NGS：重测序的回帖和变异鉴定, 变异的功能预测, 期中考试, 新一代测序NGS：转录组分析RNA-Seq, 非编码RNA的预测及分析, 本体论、分子通路鉴定, 生物信息数据库及软件资源, 研究案例 I -- 新基因起源, 研究案例II- DNA甲基化酶的演化功能分析, 期末考试 Health",4.8,25.0,Not applicable,Coursera,"Introduction and history, sequence alignment, sequence database search, Markov models, next-generation sequencing NGS: resequencing and variant identification, functional prediction of variants, midterm exam, next-generation sequencing NGS: transcriptome analysis RNA-Seq, prediction and analysis of non-coding RNA, ontology, molecular pathway identification, biological information databases and software resources, case study I - new gene origin, case study II - evolutionary functional analysis of DNA methyltransferases, final exam Health",Bioinformatics: Introduction and Methods
Methods and Statistics in Social Science - Final Research Project,"Not specified Not specified About the Final Research Project, Preparing for Milestone 1 - Research topic, Milestone 1 - General hypothesis and design, Milestone 2 - Design, operationalizations and expectations, Milestone 3 - Measurement and manipulation material, Milestone 4 - Data collection, methods documentation and  analysis plan, Milestone 5 - Statistical analysis, Milestone 6 - Report, Putting it all together (catch-up week), Reflection (catch-up week) Health",4.4,13.0,Beginner,Coursera,"Not specified Not specified About the Final Research Project, Preparing for Milestone 1 - Research topic, Milestone 1 - General hypothesis and design, Milestone 2 - Design, operationalizations and expectations, Milestone 3 - Measurement and manipulation material, Milestone 4 - Data collection, methods documentation and  analysis plan, Milestone 5 - Statistical analysis, Milestone 6 - Report, Putting it all together (catch-up week), Reflection (catch-up week) Health",Methods and Statistics in Social Science - Final Research Project
Building on the SIR Model,"Distinguish between stochastic and deterministic models, explain when either are appropriate, and perform simple simulations of a stochastic modelIdentify where it is important to incorporate population structure in a model and design and simulate a transmission model capturing such structure Evaluate the assumptions behind the Ross MacDonald model, and code such a model using R to simulate the dynamics of a vector-borne disease Critically evaluate a modelling study and communicate its strengths and weaknesses to a scientifically literate audience  Mathematical Model, R Programming, Infectious Diseases Building on the SIR Model: Stochasticity, Building on the SIR model: Heterogeneity, Building on the SIR model: Vector-borne Diseases , Assignment: Modelling Study Critique Health",4.6,20.0,Intermediate,Coursera,"Distinguish between stochastic and deterministic models, explain when either are appropriate, and perform simple simulations of a stochastic modelIdentify where it is important to incorporate population structure in a model and design and simulate a transmission model capturing such structure Evaluate the assumptions behind the Ross MacDonald model, and code such a model using R to simulate the dynamics of a vector-borne disease Critically evaluate a modelling study and communicate its strengths and weaknesses to a scientifically literate audience  Mathematical Model, R Programming, Infectious Diseases Building on the SIR Model: Stochasticity, Building on the SIR model: Heterogeneity, Building on the SIR model: Vector-borne Diseases , Assignment: Modelling Study Critique Health",Building on the SIR Model
Predictive Modeling and Transforming Clinical Practice,"Not specified Not specified Introduction: Clinical Prediction Models, Tools: Ensuring Model Usability, Techniques: Model Implementation and Sustainability, Techniques: Data Selection, Model Building, and Evaluation, Practical Application: Developing a Clinical Prediction Model Health",0.0,11.0,Intermediate,Coursera,"Not specified Not specified Introduction: Clinical Prediction Models, Tools: Ensuring Model Usability, Techniques: Model Implementation and Sustainability, Techniques: Data Selection, Model Building, and Evaluation, Practical Application: Developing a Clinical Prediction Model Health",Predictive Modeling and Transforming Clinical Practice
口腔种植学 （Implant Dentistry）,"Not specified Not specified 种植牙，生物学基础，技术工艺\t \t \t \t \t \t \t \t \t \t \t \t \t \t \t, 种植牙和患者, 种植牙手术, 种植牙的修复, 种植牙的术后、未来的发展 Health",4.9,25.0,Intermediate,Coursera,"Not specified, not specified, dental implants, biological basis, technical process, dental implants and patients, dental implant surgery, restoration of dental implants, postoperative care of dental implants, future development of dental implants, health.",Implant Dentistry
 Prehospital care of acute stroke and patient selection for endovascular treatment using the RACE scale,"Not specified Not specified Introduction, Stroke and treatment options, THE STROKE CODE, THE RACE SCALE Health",4.8,12.0,Intermediate,Coursera,"No especificado No especificado Introducción, Accidente cerebrovascular y opciones de tratamiento, EL CÓDIGO DE ACCIDENTE CEREBROVASCULAR, LA ESCALA DE RACE Salud", Prehospital care of acute stroke and patient selection for endovascular treatment using the RACE scale
Translating Research to Communities ,"Understand concepts of population health research and the ethical use of data science to drive advances in human health.Understand the importance of involving communities in research.Explore models of community inclusion in conducting research and in sharing research findings, including contemporary public health examples. healthcare, Research, Translational science Week 1 , Week 2, Week 3 Health",0.0,7.0,Beginner,Coursera,"Understand concepts of population health research and the ethical use of data science to drive advances in human health.Understand the importance of involving communities in research.Explore models of community inclusion in conducting research and in sharing research findings, including contemporary public health examples. healthcare, Research, Translational science Week 1 , Week 2, Week 3 Health",Translating Research to Communities 
Cómo captar talento en la era de la digitalización,"Not specified Not specified Cómo captar talento en la era de la digitalización, Primeros pasos, Reclutamiento, Entrevista de selección, Onboarding Health",0.0,7.0,Beginner,Coursera,"Not specified Not specified How to attract talent in the era of digitalization, First steps, Recruitment, Selection interview, Onboarding Health",How to attract talent in the era of digitalization
Integrated Analysis in Systems Biology,"Not specified Not specified General Features of Systems Biology Studies, Issues of Reproducibility in Systems Biology, Introduction to Research Article 2, Introduction to Research Article 3 Health",4.6,4.0,Not applicable,Coursera,This text is already in English.,Integrated Analysis in Systems Biology
Opioid Epidemic: From Evidence to Impact ,"Identify data sources for information about the opioid epidemic in the United States and explain general trends in opioid overdose deaths.Identify ways that prescription drug monitoring programs (PDMPs) can be used to reduce the supply of prescription opioids Explain why pharmacy benefit managers are relevant to opioid epidemicExplain the role of prescribing guidelines, safe storage, treatment, reducing stigma, and product design in opioid epidemic Pharmacology, Health Policy, Harm Reduction, Public Health Introduction and Data, Prescription Drug Monitoring Programs (PDMPs), Clinical Guidelines, Pharmacy Benefit Managers, Engineering Strategies, Engaging Patients and the General Public, Treating Opioid Use Disorders, Naloxone, Harm Reduction, Stigma Health",4.7,7.0,Beginner,Coursera,"Identify data sources for information about the opioid epidemic in the United States and explain general trends in opioid overdose deaths.Identify ways that prescription drug monitoring programs (PDMPs) can be used to reduce the supply of prescription opioids Explain why pharmacy benefit managers are relevant to opioid epidemicExplain the role of prescribing guidelines, safe storage, treatment, reducing stigma, and product design in opioid epidemic Pharmacology, Health Policy, Harm Reduction, Public Health Introduction and Data, Prescription Drug Monitoring Programs (PDMPs), Clinical Guidelines, Pharmacy Benefit Managers, Engineering Strategies, Engaging Patients and the General Public, Treating Opioid Use Disorders, Naloxone, Harm Reduction, Stigma Health",Opioid Epidemic: From Evidence to Impact 
Measuring and Modeling Impact in Evaluations,"Not specified Evaluation, Measurement Introduction to Measuring and Modeling Impact , Measuring Mortality and Maternal Mortality, Measuring and Modelling Mortality in Children, Nutrition, Other Impact Measures, Modeling Impact, Topics In LiST Health",0.0,14.0,Intermediate,Coursera,"Not specified Evaluation, Measurement Introduction to Measuring and Modeling Impact , Measuring Mortality and Maternal Mortality, Measuring and Modelling Mortality in Children, Nutrition, Other Impact Measures, Modeling Impact, Topics In LiST Health",Measuring and Modeling Impact in Evaluations
Manejo de Crisis Epilépticas y Promoción de la Inclusión Social,"Not specified crisis epilepsia, automanejo epilepsia, epilepsia niños jóvenes y adultos, autocuidado epilepsia, inclusion epilepsia Módulo 1: Crisis epiléptica y ¿Qué es la epilepsia?, Módulo 2: ¿Cómo es el tratamiento de la epilepsia? Epilepsias en la adultez, Módulo 3: Epilepsias en la niñez y adolescencia; y apoyo en el entorno escolar , Módulo 4: Promover un entorno inclusivo en Epilepsia Health",4.9,14.0,Beginner,Coursera,"Not specified crisis epilepsia, automanejo epilepsia, epilepsia niños jóvenes y adultos, autocuidado epilepsia, inclusion epilepsia Módulo 1: Crisis epiléptica y ¿Qué es la epilepsia?, Módulo 2: ¿Cómo es el tratamiento de la epilepsia? Epilepsias en la adultez, Módulo 3: Epilepsias en la niñez y adolescencia; y apoyo en el entorno escolar , Módulo 4: Promover un entorno inclusivo en Epilepsia Health",Management of Epileptic Crises and Promotion of Social Inclusion
 Manejo del enfermo semicrítico y crítico por COVID-19,"Not specified Not specified ¡Bienvenido/a! Programa formativo en el manejo del paciente semicrítico y crítico por COVID-19, Unidad 01-¿Qué es la COVID-19 ?, Unidad 02 - ¿Cómo me protejo?, Unidad 03- ¿Cómo se diagnostica?, Unidad 04- Abordaje de la vía aérea, Unidad 05- Sedación y analgesia, Unidad 06- Medidas de soporte respiratorio, Unidad 07-Ventilación mecánica invasiva, Unidad 08- Abordaje de la hipoxemia refractaria, Unidad 09- Tratamiento farmacológico , Unidad 10- Complicaciones extrapulmonares, Unidad 11- Cuidados de enfermería, Unidad 12- Herramientas de comunicación, Unidad 13- Funciones ampliadas de UCI, Unidad 14- Consideraciones éticas Health",4.8,37.0,Expert,Coursera,"Not specified Welcome! Training program in the management of semi-critical and critical COVID-19 patients, Unit 01- What is COVID-19?, Unit 02 - How do I protect myself?, Unit 03- How is it diagnosed?, Unit 04- Airway management, Unit 05- Sedation and analgesia, Unit 06- Respiratory support measures, Unit 07- Invasive mechanical ventilation, Unit 08- Approach to refractory hypoxemia, Unit 09- Pharmacological treatment, Unit 10- Extrapulmonary complications, Unit 11- Nursing care, Unit 12- Communication tools, Unit 13- Expanded functions of ICU, Unit 14- Ethical considerations.",Management of the semi-critical and critical patient with COVID-19
Helping Families Avoid Negative Court Involvement Teach-Out,"Not specified Communication, Law, safety What is Preventative Law?, Thinking Preventatively, Applying Preventative Law to Family Law: Anticipatory Planning Health",0.0,3.0,Beginner,Coursera,"Not specified Communication, Law, safety What is Preventative Law?, Thinking Preventatively, Applying Preventative Law to Family Law: Anticipatory Planning Health",Helping Families Avoid Negative Court Involvement Teach-Out
Molecular Tumor Board 2021-22 ,"Not specified Not specified Thoracic Tumor - Somatic and germinal, both are deletions by Dr. Lucio Ghiglione, Learning from failures by Dr. Helena Oliveres, Selecting patients for PARPis in Ovarian Cancer: ¿How can we best indentify them? by Dr. Lydia Gaba, Intrinsic Subtypes and Therapeutic Decision-Making in HR+HER2-negative Metastatic Breast Cancer by Dr. Francesco Schettini, DNA repair and clinical evolutiol of metastatic prostate cancer by Dr. Caterina Aversa, Change in phenotype and somatic BRCA1 mutation in a patient with advanced breast cancer by Dr. Barbara Adamo, Done right, went wrong by Dr. Victor Albarran, Can be guided treatment strategy without somatic molecular profile? by Dr. Juan Carlos Laguna, Precision medicine in non-melanoma skin cancer by Dr. Elia Segui, Unexpected response in a rare tumor by Dr. David Pesantez, Mejorando la supervivencia en cáncer de mama mestatásico by Dr. Maria Vidal, Beyond BRCA1 and 2 in ovarian cancer by Dr. Adela Rodríguez, ""Not everything is what it seems to be”... The correct interpretation of tumor molecular studies and the importance of a multidisciplinar approach Dr. Belen Pastor, Never too late to think twice by Dr. Marta García de Herreros, Do we have predictive biomarkers in urothelial carcinoma (UC) beyond FGFR alterations? by Dr. Oscar Reig, Agnostic Biomarker in solid tumors by Dr. Laura Angelats, What acral melanoma hides by Dr. Roberto Martín, Molecular Family by Dr. Roxana Reyes,  Is there any rol for precision medicine in rare pacreatic cancer? by Dr. Francis Espósito, Beyond the classical EGFR resistance mechanisms by Teresa Gorria, Breast cancer: Beyond intrinsic subtypes by Raquel Gómez, Intrahepatic cholangiocarcinoma: beyond chemotherapy by Dr. Iván Victoria, Exploiting genomics in serous endometrial cancer by Lydia Gaba, Beyond classical BRAF mutations in melanoma by Dr. Marta García de Herreros, Can we talk about Precision Immuno-Oncology in HR+ HER2- Breast Cancer? by Elia Seguí, Brain tumor by Estela Pineda Health",0.0,35.0,Intermediate,Coursera,"Not specified Not specified Thoracic Tumor - Somatic and germinal, both are deletions by Dr. Lucio Ghiglione, Learning from failures by Dr. Helena Oliveres, Selecting patients for PARPis in Ovarian Cancer: ¿How can we best indentify them? by Dr. Lydia Gaba, Intrinsic Subtypes and Therapeutic Decision-Making in HR+HER2-negative Metastatic Breast Cancer by Dr. Francesco Schettini, DNA repair and clinical evolutiol of metastatic prostate cancer by Dr. Caterina Aversa, Change in phenotype and somatic BRCA1 mutation in a patient with advanced breast cancer by Dr. Barbara Adamo, Done right, went wrong by Dr. Victor Albarran, Can be guided treatment strategy without somatic molecular profile? by Dr. Juan Carlos Laguna, Precision medicine in non-melanoma skin cancer by Dr. Elia Segui, Unexpected response in a rare tumor by Dr. David Pesantez, Mejorando la supervivencia en cáncer de mama mestatásico by Dr. Maria Vidal, Beyond BRCA1 and 2 in ovarian cancer by Dr. Adela Rodríguez, ""Not everything is what it seems to be”... The correct interpretation of tumor molecular studies and the importance of a multidisciplinar approach Dr. Belen Pastor, Never too late to think twice by Dr. Marta García de Herreros, Do we have predictive biomarkers in urothelial carcinoma (UC) beyond FGFR alterations? by Dr. Oscar Reig, Agnostic Biomarker in solid tumors by Dr. Laura Angelats, What acral melanoma hides by Dr. Roberto Martín, Molecular Family by Dr. Roxana Reyes,  Is there any rol for precision medicine in rare pacreatic cancer? by Dr. Francis Espósito, Beyond the classical EGFR resistance mechanisms by Teresa Gorria, Breast cancer: Beyond intrinsic subtypes by Raquel Gómez, Intrahepatic cholangiocarcinoma: beyond chemotherapy by Dr. Iván Victoria, Exploiting genomics in serous endometrial cancer by Lydia Gaba, Beyond classical BRAF mutations in melanoma by Dr. Marta García de Herreros, Can we talk about Precision Immuno-Oncology in HR+ HER2- Breast Cancer? by Elia Seguí, Brain tumor by Estela Pineda Health",Molecular Tumor Board 2021-22 
Strategies for Senior Housing Communities during COVID-19,"Develop emergency preparedness plans related to COVID-19 policies, practices and proceduresEmploy effective COVID-related infection prevention strategies and communication methodsUnderstand regulations around managing occupancy, community access, and behaviorIdentify methods for promoting staff and resident well-being during COVID-19 infection prevention, Emergency Management, Housing Operations, Well-being Promotion COVID-19 Background and Senior Housing Challenges, Infection Prevention, Senior Housing Operations, Promoting Mental Health and Well-being, Health Department Partnerships & Vaccination Guidance, Final Assessment Health",4.8,10.0,Beginner,Coursera,"Develop emergency preparedness plans related to COVID-19 policies, practices and proceduresEmploy effective COVID-related infection prevention strategies and communication methodsUnderstand regulations around managing occupancy, community access, and behaviorIdentify methods for promoting staff and resident well-being during COVID-19 infection prevention, Emergency Management, Housing Operations, Well-being Promotion COVID-19 Background and Senior Housing Challenges, Infection Prevention, Senior Housing Operations, Promoting Mental Health and Well-being, Health Department Partnerships & Vaccination Guidance, Final Assessment Health",Estrategias para comunidades de viviendas para personas mayores durante COVID-19
Specialty Topics: Biology Across Disciplines,"Describe how biology as a field interfaces with other fields, in particular the arts, business and psychology. Explain how we use evidence to make decisions and why this is important to consider when promoting science literacy. Not specified The Arts and Biology, The Business of Biology , Tiny Humans: An Exposé at the Intersection of Psychology and Biology, Making Decisions Using Biological Evidence, Biology, Psychology, and Education  Health",4.5,12.0,Beginner,Coursera,"Biology intersects with other fields such as the arts, business, and psychology. We use evidence to make decisions, which is crucial for promoting science literacy. Topics include the relationship between biology and the arts, the business aspects of biology, the intersection of psychology and biology in understanding human behavior, and the importance of using biological evidence to make decisions in various fields such as health, education, and psychology.",Specialty Topics: Biology Across Disciplines
