Course Title,Course Info,Course Rating,Course Duration,Course Level,Source,Course Info Translate,Course Title Translate
Innovación y emprendimiento  Specialization,"Determinar las estrategias y herramientas que los emprendedores y startups utilizan para desarrollar ideas de negocio y lanzar innovaciones.Identificar los conceptos del modelo de negocio, diseñar proposiciones de valor y distinguir los principios de la innovación en las nuevas empresas. Analizar el entorno empresarial externo y evaluar las fuerzas competitivas que afectan a la organización, Distinguir los principios de la innovación y explicar la gestión de la innovación, Aplicar los principios del pensamiento de diseño a la resolucion innovadora de problemas, Identificar los conceptos del modelo de negocio y diseñar proposiciones de valor únicas, Analizar las iniciativas de innovación dentro de la organización, Identificar los conceptos básicos de emprendimiento innovador para innovar y crear valor en la empresa, Determinar las estrategias y herramientas que los emprendedores y startups utilizan para desarrollar y emprender las innovaciones, Explicar como los emprendedores pueden ir de una idea a un producto y escalarlo, Identificar como la innovación se vincula a las estrategias de desarrollo de las organizaciones, El emprendimiento corporativo como estrategia de crecimiento y desarrollo organizacional, La importancia de la innovación en las organizaciones, La importancia de la cultura emprendedora en la organizacion, Valorar la tecnología como estrategia para conectarse con la audiencia clave, Distinguir los elementos de un modelo de negocios, Identificar patrones clave de los negocios a traves del BMC, mapeo y diseño de sistemas, Organizar la complejidad mediante: pensamiento visual Mentalidad Emprendedora, Innovación y creatividad organizacional, Diseño e innovación de modelo de negocios, Emprendimiento Corporativo Business",4.6,120.0,Expert,Coursera,"Identifying the strategies and tools that entrepreneurs and startups use to develop business ideas and launch innovations. Identifying the concepts of the business model, designing value propositions, and distinguishing the principles of innovation in new companies. Analyzing the external business environment and evaluating the competitive forces that affect the organization. Distinguishing the principles of innovation and explaining innovation management. Applying design thinking principles to innovative problem-solving. Identifying business model concepts and designing unique value propositions. Analyzing innovation initiatives within the organization. Identifying the basic concepts of innovative entrepreneurship to innovate and create value in the company. Determining the strategies and tools that entrepreneurs and startups use to develop and launch innovations. Explaining how entrepreneurs can go from an idea to a product and scale it. Identifying how innovation is linked to organizational development strategies. Corporate entrepreneurship as a strategy for growth and organizational development. The importance of innovation in organizations. The importance of entrepreneurial culture in the organization. Valuing technology as a strategy to connect with the key audience. Distinguishing the elements of a business model. Identifying key business patterns through the BMC, mapping, and system design. Organizing complexity through: visual thinking, entrepreneurial mindset, organizational innovation and creativity, business model design and innovation, Corporate Entrepreneurship Business.",Innovation and Entrepreneurship Specialization
What is Corruption: Anti-Corruption and Compliance,"Provide examples of anti-corruption laws and explain the implicationsDescribe the relationship between anti-corruption efforts and an organization’s culture and compliance programsIdentify strategies for avoiding corruption issuesProvide strategies for structuring a comprehensive anti-corruption program that can prevent and/or mitigate corruption in an organization.  Risk Management, Operations Management, Corruption, Strategic Planning Corruption - What is it? Where is it?, Anti-Corruption Laws, Anti-Corruption Compliance Programs (aka How to Avoid Corruption Issues), Preventing Corruption Business",4.9,11.0,Not applicable,Coursera,"Provide examples of anti-corruption laws and explain the implicationsDescribe the relationship between anti-corruption efforts and an organization’s culture and compliance programsIdentify strategies for avoiding corruption issuesProvide strategies for structuring a comprehensive anti-corruption program that can prevent and/or mitigate corruption in an organization.  Risk Management, Operations Management, Corruption, Strategic Planning Corruption - What is it? Where is it?, Anti-Corruption Laws, Anti-Corruption Compliance Programs (aka How to Avoid Corruption Issues), Preventing Corruption Business",What is Corruption: Anti-Corruption and Compliance
Introduction to Blockchain Technologies,"The limitations of the Internet for business and economic activity, and how trust is established in a pre- and post-blockchain worldTerms such as miner, hash, nonce, proof-of-work, and public key cryptography, as well as the steps of a blockchain transactionSeven design principles for blockchain technologyTen challenges associated with implementing blockchain technology Not specified The Second Era of the Internet, Blockchain Design Principles, Public and Private Ledgers, The Blockchain Ecosystem, Blockchain Implementation Challenges Business",4.7,28.0,Beginner,Coursera,"The limitations of the Internet for business and economic activity, and how trust is established in a pre- and post-blockchain worldTerms such as miner, hash, nonce, proof-of-work, and public key cryptography, as well as the steps of a blockchain transactionSeven design principles for blockchain technologyTen challenges associated with implementing blockchain technology Not specified The Second Era of the Internet, Blockchain Design Principles, Public and Private Ledgers, The Blockchain Ecosystem, Blockchain Implementation Challenges Business",Introduction to Blockchain Technologies
Fashion Design,"Innovative new design process techniques based on original researchHow to apply environmentally friendly initiatives to product developmentWays to demonstrate partnership with other brandsAbility to assess the sociocultural relationship between society and fashion Trend Analysis, ethical design and production, Innovation, Collaboration, design technique The Fashion Design Process, Fashion Design: A Sustainable Approach, Collaborative Design, Fashion Trends: Interpretation, Observation and Intuition Business",4.6,10.0,Intermediate,Coursera,"Innovative new design process techniques based on original researchHow to apply environmentally friendly initiatives to product developmentWays to demonstrate partnership with other brandsAbility to assess the sociocultural relationship between society and fashion Trend Analysis, ethical design and production, Innovation, Collaboration, design technique The Fashion Design Process, Fashion Design: A Sustainable Approach, Collaborative Design, Fashion Trends: Interpretation, Observation and Intuition Business",Fashion Design
Strategic Technology Management Specialization,"Not specified Technology Strategy, New Product Development, Customer Behavior and Innovation, Innovation Management, Business model innovation Technology Strategy: Creative Destruction, Customer Centric Innovation, Managing Innovation: Ambidexterity, Teams and Leading Change Business",4.7,40.0,Beginner,Coursera,The text is already in English.,Strategic Technology Management Specialization
Credit Risk Management: Frameworks and Strategies,"Use business and industry analysis to understand companies, projects, business models, and financing proposalsPrepare a qualitative risk analysis for specific companies to use as the basis for financial analysis, project analysis, and risk decisionsUnderstand the principles & concepts of credit risk including categories of risk, types of exposure, credit products, expected/unexpected credit loss Credit Analysis, Financial Analysis, credit risk Getting Started, Module 1: Principles and Concepts\u200b, Module 2:  Default Trends and Market Indicators\u200b, Module 3: Credit Portfolio Management\u200b, End of Course Business",4.6,8.0,Beginner,Coursera,"Use business and industry analysis to understand companies, projects, business models, and financing proposals. Prepare a qualitative risk analysis for specific companies to use as the basis for financial analysis, project analysis, and risk decisions. Understand the principles and concepts of credit risk including categories of risk, types of exposure, credit products, expected and unexpected credit loss. The course covers Credit Analysis, Financial Analysis, and credit risk. Modules include Getting Started, Principles and Concepts, Default Trends and Market Indicators, and Credit Portfolio Management. The course concludes with a Business Analysis.",Credit Risk Management: Frameworks and Strategies
Foundations of Sensory Science Specialization,"Not specified Sensory Science, Human Senses, Sensory Research, Product Development Introduction to Sensory Science, Sensory Science: The Senses, Sensory Science: Measuring the Senses, Sensory Science: Conducting Tests Business",4.7,40.0,Beginner,Coursera,"Not specified Sensory Science, Human Senses, Sensory Research, Product Development Introduction to Sensory Science, Sensory Science: The Senses, Sensory Science: Measuring the Senses, Sensory Science: Conducting Tests Business",Foundations of Sensory Science Specialization
High Stakes Leadership: Leading in Times of Crisis,"Develop strategies for exceptional leadership and team performance in our increasingly VUCA world.Explore the characteristics of individual and organizational resilience and develop strategies to improve both.Understand how to prepare yourself, your team, and your organization for its next major disruption or crisis. Change Management, Communication, Strategy & Operation, Crisis leadership, Leadership & Management Modules 1 & 2: Course Introduction and Our VUCA Environment Demands a Focus on Stakeholders, Modules 3 & 4: Developing Resilience and Understanding Stakeholder Reactions to Crises, Modules 5 & 6: Crisis Varieties, Responses, and the Unique Nature of the Crisis Environment, Modules 7 & 8: Crisis Leadership and Preparing for Future Crises Business",4.7,35.0,Intermediate,Coursera,"Develop strategies for exceptional leadership and team performance in our increasingly VUCA world.Explore the characteristics of individual and organizational resilience and develop strategies to improve both.Understand how to prepare yourself, your team, and your organization for its next major disruption or crisis. Change Management, Communication, Strategy & Operation, Crisis leadership, Leadership & Management Modules 1 & 2: Course Introduction and Our VUCA Environment Demands a Focus on Stakeholders, Modules 3 & 4: Developing Resilience and Understanding Stakeholder Reactions to Crises, Modules 5 & 6: Crisis Varieties, Responses, and the Unique Nature of the Crisis Environment, Modules 7 & 8: Crisis Leadership and Preparing for Future Crises Business",High Stakes Leadership: Leading in Times of Crisis
"Project Management Communication, Stakeholders & Leadership ","Discuss ways to foster a healthy environment for team members and explain the effects of empowering team members.Demonstrate better project communications by applying different communication skills and mediums. Apply leadership skills to get positive project outcomes, build trusting teams, and establish strong stakeholder relationships.Demonstrate increased stakeholder engagement by applying the knowledge and skills to acquire resources and keep stakeholders involved in the project. Project Management, Communication, Leadership, Stakeholder Management Creating a Healthy Project Foundation, Effective Communications Building Blocks, Communications Planning, Leadership Fundamentals,  Managing and Leading Stakeholders, Final Project and Quiz Business",4.6,19.0,Beginner,Coursera,"Discussing ways to create a healthy environment for team members and explaining the effects of empowering team members. Demonstrating improved project communications by utilizing various communication skills and methods. Applying leadership skills to achieve positive project results, develop trusting teams, and establish strong relationships with stakeholders. Showing increased stakeholder engagement by using knowledge and skills to obtain resources and keep stakeholders engaged in the project. Topics include Project Management, Communication, Leadership, Stakeholder Management, Establishing a Healthy Project Foundation, Effective Communication Strategies, Communication Planning, Leadership Basics, Managing and Leading Stakeholders, Final Project, and Quiz in Business.","Project Management Communication, Stakeholders & Leadership "
Cryptocurrency and Blockchain: An Introduction to Digital Currencies,"Not specified Not specified Module 1: Introduction to Cryptocurrency, Module 2: Rules and Structure of Bitcoin, Module 3: Cryptocurrency as an Asset Class, Module 4: The Blockchain Ecosystem Business",4.6,4.0,Not applicable,Coursera,"Not specified Not specified Module 1: Introduction to Cryptocurrency, Module 2: Rules and Structure of Bitcoin, Module 3: Cryptocurrency as an Asset Class, Module 4: The Blockchain Ecosystem Business",Cryptocurrency and Blockchain: An Introduction to Digital Currencies
Strategic Planning and Execution,"How to connect strategic analysis to strategy execution using hypothesis testing to unearth key assumptions and assess their validityFour different approaches to strategy formulation and how governance ties into effective strategy formulationUse the 4A Model for effective strategy execution to ensure appropriate human and organizational resources are in place Tips from industry experts for successful strategy development and execution Strategy Implementation, Strategy Formulation, Business Strategy, Business hypothesis testing Strategy Analysis, Strategy Formulation, Strategy Implementation, Practical Perspectives Business",4.7,10.0,Not applicable,Coursera,"How to connect strategic analysis to strategy execution using hypothesis testing to unearth key assumptions and assess their validityFour different approaches to strategy formulation and how governance ties into effective strategy formulationUse the 4A Model for effective strategy execution to ensure appropriate human and organizational resources are in place Tips from industry experts for successful strategy development and execution Strategy Implementation, Strategy Formulation, Business Strategy, Business hypothesis testing Strategy Analysis, Strategy Formulation, Strategy Implementation, Practical Perspectives Business",Strategic Planning and Execution
Fundamentals of Equities,"Acquire skills and understanding related to stocks, exchange-traded funds (ETFs), and mutual fundsHow to perform basic fundamental analysesLearn how to examine investment benefits and risksGain hands-on know-how through practical demonstrations of certain online trading methods Business Cycle, Fundamental Analysis, Sectors, Mutual Funds, Stocks Stocks & the Business Cycle, Fundamental Analysis, Funds Business",4.4,11.0,Beginner,Coursera,"Acquire skills and understanding related to stocks, exchange-traded funds (ETFs), and mutual fundsHow to perform basic fundamental analysesLearn how to examine investment benefits and risksGain hands-on know-how through practical demonstrations of certain online trading methods Business Cycle, Fundamental Analysis, Sectors, Mutual Funds, Stocks Stocks & the Business Cycle, Fundamental Analysis, Funds Business",Fundamentals of Equities
Adapting: Career Development Specialization,"Critically evaluate the process of self-directed personal change and apply it to an area of leadership development. Understand the drivers of stress and strategies to enhance your resilience in dealing with stress.Evaluate career management issues and design a career path that fits personal values, interests, personality, and skills.Critically evaluate the nature of cultural intelligence and apply strategies to develop your cultural sensitivity in managing diversity. Diversity (Business), Stress Management, Career Development, Resilience, Cultural intelligence Build personal resilience, Cultural intelligence: Become a global citizen, Career planning: Your career, your life, Professional development: Improve yourself, always Business",4.8,80.0,Beginner,Coursera,"Critically assess the process of self-directed personal change and apply it to leadership development. Identify stress triggers and develop strategies to increase resilience in handling stress. Evaluate career management challenges and create a career path that aligns with personal values, interests, personality, and skills. Critically analyze cultural intelligence and implement strategies to enhance cultural sensitivity in diversity management. Topics include Diversity in Business, Stress Management, Career Development, Resilience, and Cultural Intelligence. Build personal resilience, develop cultural intelligence, plan your career, focus on professional development, and continuously improve yourself in the business world.",Adapting: Career Development Specialization
The AI Ladder: A Framework for Deploying AI in your Enterprise,"Not specified Artificial Intelligence (AI), Analytics, Leadership, Management, Innovation Introduction to AI and the AI Ladder Business",4.7,2.0,Beginner,Coursera,"Not specified Artificial Intelligence (AI), Analytics, Leadership, Management, Innovation Introduction to AI and the AI Ladder Business",The AI Ladder: A Framework for Deploying AI in your Enterprise
Data-Driven Leadership Skills Specialization,"Not specified Data-Informed Decision-Making, Critical Thinking, Decision-Making, Agile Management, Leadership, Leadership And Management Data-Driven Leadership Skills Course 1: Leadership Narrative, Data-Driven Leadership Skills Course 2: Agile Leadership, Data-Driven Leadership Skills Course 3: Data-Driven Leaders, Data-Driven Leadership Skills Capstone Project Business",0.0,40.0,Intermediate,Coursera,"Not specified Data-Informed Decision-Making, Critical Thinking, Decision-Making, Agile Management, Leadership, Leadership And Management Data-Driven Leadership Skills Course 1: Leadership Narrative, Data-Driven Leadership Skills Course 2: Agile Leadership, Data-Driven Leadership Skills Course 3: Data-Driven Leaders, Data-Driven Leadership Skills Capstone Project Business",Data-Driven Leadership Skills Specialization
Why Smart Executives Fail: Common Mistakes & Warning Signs,"Which mistakes leaders make most oftenHow to spot the early warning signs of key mistakesHow to avoid making these same mistakes in your own life Change Management, Strategic Leadership, Learning, Learning from Failure, Leadership Development What Great Strategists Know, The Delusions of a Dream Company, The Manager as Master Puzzle Solver, The Seven Habits of Spectacularly Unsuccessful People Business",4.9,16.0,Beginner,Coursera,"Which mistakes leaders make most oftenHow to spot the early warning signs of key mistakesHow to avoid making these same mistakes in your own life Change Management, Strategic Leadership, Learning, Learning from Failure, Leadership Development What Great Strategists Know, The Delusions of a Dream Company, The Manager as Master Puzzle Solver, The Seven Habits of Spectacularly Unsuccessful People Business",Why Smart Executives Fail: Common Mistakes & Warning Signs
Doing more with Google Sheets,"Not specified Spreadsheet, Data Analysis, Data Reporting, Google Sheets, Data Visualization Welcome to Google Sheets: how to create, edit, and print your spreadsheet, Working with formulas and functions: how to import and analyze your data, Telling stories with data: how to design your sheet to highlight trends, Supercharge your sheet: how to create charts, pivot tables, and reports, Collaborating in Sheets: how to share your data with your team Business",4.6,5.0,Beginner,Coursera,"Not specified Spreadsheet, Data Analysis, Data Reporting, Google Sheets, Data Visualization Welcome to Google Sheets: how to create, edit, and print your spreadsheet, Working with formulas and functions: how to import and analyze your data, Telling stories with data: how to design your sheet to highlight trends, Supercharge your sheet: how to create charts, pivot tables, and reports, Collaborating in Sheets: how to share your data with your team Business",Doing more with Google Sheets
Gestión de la comunicación interna en las organizaciones,"Not specified Not specified Gestión de la comunicación interna en las organizaciones, ¿Qué es la comunicación interna?, ¿Cómo se hace el plan de comunicación interna de una organización?, Comunicación interna y estrategia empresarial, Comunicación interna y estrategia empresarial, Gestión y elementos de la comunicación interna Business",4.8,18.0,Beginner,Coursera,"Internal communication management in organizations, What is internal communication?, How is the internal communication plan of an organization made?, Internal communication and business strategy, Management and elements of internal communication Business",Internal communication management in organizations
Agile Project Management,"By successfully completing this course, you will be able to distinguish between Agile and predictive project management methodologies.You will also be able to describe the roles and responsibilities of different members of an agile team and implement agile tools.And you will be able to identify agile organizations and styles of leadership. Project Management, Strategic Management, Agile Management, Servant Leadership, Engineering management Agile Project Management, The Agile Process, The Agile Organization Business",4.8,18.0,Beginner,Coursera,"By successfully completing this course, you will be able to distinguish between Agile and predictive project management methodologies.You will also be able to describe the roles and responsibilities of different members of an agile team and implement agile tools.And you will be able to identify agile organizations and styles of leadership. Project Management, Strategic Management, Agile Management, Servant Leadership, Engineering management Agile Project Management, The Agile Process, The Agile Organization Business",Agile Project Management
Negociações de sucesso: estratégias e habilidades essenciais (em Português),"Not specified Strategic Management, Communication, Negotiation, Arbitrage Prepare-se: Planeje sua Estratégia de Negociação, Negocie: Use Táticas-Chave para o Sucesso, Feche: Crie um Contrato, Execução e Avaliação: O Jogo Final, Pratique suas Habilidades de Negociação, Exame Final Business",4.9,12.0,Not applicable,Coursera,"Strategic Management, Communication, Negotiation, Arbitrage Not specified Prepare: Plan your Negotiation Strategy, Negotiate: Use Key Tactics for Success, Close: Create a Contract, Execution and Evaluation: The Final Game, Practice your Negotiation Skills, Final Exam Business",Successful Negotiations: Essential Strategies and Skills (in English)
Understanding Financial Markets,"Not specified Bond Market, Interest Rate, Stock, Financial Markets General Introduction and Key Concepts, Major Financial Markets, Other Financial Markets, Financial Markets and the Economy Business",4.8,10.0,Beginner,Coursera,The text is already in English and does not require translation.,Understanding Financial Markets
Excel Power Tools for Data Analysis,"Not specified Big Data, Data Analysis, Microsoft Excel, Data Visualization, power bi Welcome and critical information, Get and Transform (Power Query), Transforming data in the Query Editor, Power Pivot and the Data Model, Visualising Data with Power BI Business",4.9,15.0,Intermediate,Coursera,"Not specified Big Data, Data Analysis, Microsoft Excel, Data Visualization, power bi Welcome and critical information, Get and Transform (Power Query), Transforming data in the Query Editor, Power Pivot and the Data Model, Visualising Data with Power BI Business",Excel Power Tools for Data Analysis
Getting started with Microsoft Office 365,Create a free Microsoft 365 account Explore Microsoft Office 365 apps Microsoft 365 Learn step-by-step Business,4.3,2.0,Beginner,Coursera,Create a free Microsoft 365 account Explore Microsoft Office 365 apps Microsoft 365 Learn step-by-step Business,Getting started with Microsoft Office 365
