Course Title,Course Info,Course Rating,Course Duration,Course Level,Source,Course Info Translate,Course Title Translate
Core 1: Hardware and Network Troubleshooting,"Describe laptop components and accessories and apply troubleshooting methods to laptops, mobile devices, and video and resolution issues.  Explain networking infrastructures, describe storage device options, identify network troubleshooting tools, and troubleshoot storage issues.Define motherboard components and CPU types, configure BIOS settings, summarize power supply basics, and troubleshoot these items.Identify printer types, components, and settings and troubleshoot basic, advanced, laser, and impact printer issues. Laptop and Mobile Components, Hardware Troubleshooting, Printer Components and Settings, Network Troubleshooting, Motherboard and Storage Components Laptops and Other Mobile Devices\u202f, Networking and Storage, Internal Computer Components, Printers and Multi-function Devices and Maintenance\xa0, Final Exam\xa0and Honors Final Project Information Technology",4.7,16.0,Expert,Coursera,"Describe laptop components and accessories and apply troubleshooting methods to laptops, mobile devices, and video and resolution issues.  Explain networking infrastructures, describe storage device options, identify network troubleshooting tools, and troubleshoot storage issues.Define motherboard components and CPU types, configure BIOS settings, summarize power supply basics, and troubleshoot these items.Identify printer types, components, and settings and troubleshoot basic, advanced, laser, and impact printer issues. Laptop and Mobile Components, Hardware Troubleshooting, Printer Components and Settings, Network Troubleshooting, Motherboard and Storage Components Laptops and Other Mobile Devices\u202f, Networking and Storage, Internal Computer Components, Printers and Multi-function Devices and Maintenance\xa0, Final Exam\xa0and Honors Final Project Information Technology",Core 1: Hardware and Network Troubleshooting
Cybersecurity Management and Compliance,"Learn about data and record management, Information security, standards and policy formation, and implementation. Explore cloud adoption frameworks and regulatory compliance frameworks.Learn how to use available tools for compliance management. Cloud Computing Security, Cybersecurity planning, Record management, Data Management, Cloud Architecture Security administration, Compliance Solutions, Laws and standards, Final project and assessment: Cybersecurity management and compliance Information Technology",4.7,20.0,Beginner,Coursera,"Learn about data and record management, Information security, standards and policy formation, and implementation. Explore cloud adoption frameworks and regulatory compliance frameworks.Learn how to use available tools for compliance management. Cloud Computing Security, Cybersecurity planning, Record management, Data Management, Cloud Architecture Security administration, Compliance Solutions, Laws and standards, Final project and assessment: Cybersecurity management and compliance Information Technology",Cybersecurity Management and Compliance
Lean Management Fundamentals,"Apply Lean principles to identify and eliminate waste in business processes  Utilize Lean tools and techniques for process improvement, such as value stream mapping, 5S, Kaizen, and KanbanUnderstand the role of leadership in Lean management and its impact on organizational successAnalyse processes to identify improvement opportunities and design Lean solutions Process Optimization, Leadership, Metrics Analysis, Kaizen, Visual Management Lean Management: From Fundamentals to Advanced Course\t\t Information Technology",4.5,12.0,Beginner,Coursera,"Apply Lean principles to identify and eliminate waste in business processes  Utilize Lean tools and techniques for process improvement, such as value stream mapping, 5S, Kaizen, and KanbanUnderstand the role of leadership in Lean management and its impact on organizational successAnalyse processes to identify improvement opportunities and design Lean solutions Process Optimization, Leadership, Metrics Analysis, Kaizen, Visual Management Lean Management: From Fundamentals to Advanced Course\t\t Information Technology",Lean Management Fundamentals
أساسيات شبكات الكمبيوتر,"Not specified Subnetwork, Network Layer, Virtual Private Network (VPN), Switches مقدمة إلى الشبكات, طبقة الشبكة, طبقة النقل وطبقة التطبيق, خدمات الشبكات, الاتصال بالإنترنت, استكشاف الأخطاء وإصلاحها والمستقبل الذي ينتظر الشبكات Information Technology",4.7,33.0,Beginner,Coursera,"Introduction to Networks, Network Layer, Transport Layer, and Application Layer, Network Services, Internet Connectivity, Troubleshooting and the Future of Networks Information Technology",Basics of Computer Networks
Computer Security and Systems Management Specialization,"Not specified Subnetwork, Cybersecurity, Enterprise System, Linux Enterprise System Management and Security , Windows Server Management and Security, Linux Server Management and Security, Planning, Auditing and Maintaining Enterprise Systems Information Technology",4.6,40.0,Beginner,Coursera,"No especificado Subred, Ciberseguridad, Sistema Empresarial, Gestión y Seguridad de Sistemas Empresariales Linux, Gestión y Seguridad de Servidores Windows, Gestión y Seguridad de Servidores Linux, Planificación, Auditoría y Mantenimiento de Sistemas Empresariales de Tecnología de la Información.",Computer Security and Systems Management Specialization
 Preparation for CompTIA A+ Certification Specialization,"Describe and troubleshoot laptop, mobile device, video, resolution, networking, storage, motherboard, CPU, BIOS, and power supply issues.Troubleshoot various printer types and settings, and list common features and commands across operating systems.Explain the advantages of using Active Directory, Microsoft Windows security tools, data destruction for mobile device security.Demonstrate mastery of CompTIA A+ Core 1 and Core 2 domains by completing mock certification exams. Practice Exam, Network Security, Hardware Troubleshooting, Operating Systems, CompTIA A+ Core 1: Hardware and Network Troubleshooting, Core 2: OS, Software, Security and Operational Procedures, Practice Exams for CompTIA A+ Certification: Core 1 & Core 2 Information Technology",4.9,40.0,Intermediate,Coursera,"Describe and troubleshoot laptop, mobile device, video, resolution, networking, storage, motherboard, CPU, BIOS, and power supply issues.Troubleshoot various printer types and settings, and list common features and commands across operating systems.Explain the advantages of using Active Directory, Microsoft Windows security tools, data destruction for mobile device security.Demonstrate mastery of CompTIA A+ Core 1 and Core 2 domains by completing mock certification exams. Practice Exam, Network Security, Hardware Troubleshooting, Operating Systems, CompTIA A+ Core 1: Hardware and Network Troubleshooting, Core 2: OS, Software, Security and Operational Procedures, Practice Exams for CompTIA A+ Certification: Core 1 & Core 2 Information Technology", Preparation for CompTIA A+ Certification Specialization
Google Cloud Database Engineer Specialization,"Learn the skills needed to be successful in a cloud database engineer rolePrepare for the Professional Cloud Database Engineer certification examLearn how to plan, execute, test, and monitor enterprise database migrations to Google CloudMigrate and manage Cloud SQL, Cloud Spanner, and Bigtable databases Database (DBMS), Google Cloud Platform, MySQL, Cloud Platforms, Cloud Storage, Node.Js, Cloud Computing Security, Postgresql, cloud sql, Dataflow, Data Management, SQL Operations, Google Compute Engine, Google App Engine (GAE), Cloud Computing, Kubernetes A Tour of Google Cloud Hands-on Labs, Google Cloud Fundamentals: Core Infrastructure, Cloud SQL for MySQL: Qwik Start, Migrating to Cloud SQL from Amazon RDS for MySQL Using Database Migration Service, Migrating On-premises MySQL Using a Continuous Database Migration Service Job, Migrate to Cloud SQL for PostgreSQL using Database Migration Service, Connect an App to a Cloud SQL for PostgreSQL Instance, Securing a Cloud SQL for PostgreSQL Instance, Configure Replication and Enable Point-in-Time-Recovery for Cloud SQL for PostgreSQL, Cloud Spanner - Loading Data and Performing Backups, Cloud Spanner - Defining Schemas and Understanding Query Plans, Deploy a Modern Web App connected to a Cloud Spanner Instance, Enterprise Database Migration Information Technology",4.7,40.0,Intermediate,Coursera,"Learn the skills needed to be successful in a cloud database engineer rolePrepare for the Professional Cloud Database Engineer certification examLearn how to plan, execute, test, and monitor enterprise database migrations to Google CloudMigrate and manage Cloud SQL, Cloud Spanner, and Bigtable databases Database (DBMS), Google Cloud Platform, MySQL, Cloud Platforms, Cloud Storage, Node.Js, Cloud Computing Security, Postgresql, cloud sql, Dataflow, Data Management, SQL Operations, Google Compute Engine, Google App Engine (GAE), Cloud Computing, Kubernetes A Tour of Google Cloud Hands-on Labs, Google Cloud Fundamentals: Core Infrastructure, Cloud SQL for MySQL: Qwik Start, Migrating to Cloud SQL from Amazon RDS for MySQL Using Database Migration Service, Migrating On-premises MySQL Using a Continuous Database Migration Service Job, Migrate to Cloud SQL for PostgreSQL using Database Migration Service, Connect an App to a Cloud SQL for PostgreSQL Instance, Securing a Cloud SQL for PostgreSQL Instance, Configure Replication and Enable Point-in-Time-Recovery for Cloud SQL for PostgreSQL, Cloud Spanner - Loading Data and Performing Backups, Cloud Spanner - Defining Schemas and Understanding Query Plans, Deploy a Modern Web App connected to a Cloud Spanner Instance, Enterprise Database Migration Information Technology",Google Cloud Database Engineer Specialization
Intro to Operating Systems 2: Memory Management,"Foundational techniques and nuances of memory management within operating systems, including segmentation and paging.Practical strategies for implementing and optimizing virtual memory and swapping in diverse computing environments. Operating Systems, C Dynamic Memory Allocation Introduction, Segmentation, Paging, Swapping, Virtual Memory Information Technology",4.6,9.0,Expert,Coursera,"The text discusses the fundamental techniques and intricacies of memory management in operating systems, such as segmentation and paging. It also covers practical strategies for implementing and optimizing virtual memory and swapping in various computing environments. Additionally, it includes topics like C Dynamic Memory Allocation, Introduction to Segmentation, Paging, Swapping, and Virtual Memory in Information Technology.",Intro to Operating Systems 2: Memory Management
Preparing for Google Cloud Certification: Cloud Security Engineer Professional Certificate,"Learn the skills needed to be successful in a cloud security engineer rolePrepare for the Google Cloud Professional Cloud Security Engineer certification examLearn about Cloud Security including managing access, defining organizational structure/ policies, configuring network security, and analyzing logs. Google Compute Engine, Google App Engine (GAE), Google Cloud Platform, Cloud Computing, Create and understand custom IAM roles, Create and configure network peering, Secure a Kubernetes environment Preparing for Your Professional Cloud Security Engineer Journey, Google Cloud Fundamentals: Core Infrastructure, Networking in Google Cloud: Defining and Implementing Networks, Networking in Google Cloud: Hybrid Connectivity and Network Management, Managing Security in Google Cloud, Security Best Practices in Google Cloud, Mitigating Security Vulnerabilities on Google Cloud, Hands-On Labs in Google Cloud for Security Engineers Information Technology",4.8,40.0,Intermediate,Coursera,"Learn the skills needed to be successful in a cloud security engineer rolePrepare for the Google Cloud Professional Cloud Security Engineer certification examLearn about Cloud Security including managing access, defining organizational structure/ policies, configuring network security, and analyzing logs. Google Compute Engine, Google App Engine (GAE), Google Cloud Platform, Cloud Computing, Create and understand custom IAM roles, Create and configure network peering, Secure a Kubernetes environment Preparing for Your Professional Cloud Security Engineer Journey, Google Cloud Fundamentals: Core Infrastructure, Networking in Google Cloud: Defining and Implementing Networks, Networking in Google Cloud: Hybrid Connectivity and Network Management, Managing Security in Google Cloud, Security Best Practices in Google Cloud, Mitigating Security Vulnerabilities on Google Cloud, Hands-On Labs in Google Cloud for Security Engineers Information Technology",Preparing for Google Cloud Certification: Cloud Security Engineer Professional Certificate
Python Database Connection with MariaDB From Infosys,"Install a Python script interpreter and configure the MariaDB database serverCreate a Python Script which enables an efficient connection to the MariaDB serverValidate the connection to the database by testing your script Mariadb Configuration, Mariadb installation, Command-Line Interface, Python installation, Python Scripting Learn step-by-step Information Technology",4.6,1.0,Intermediate,Coursera,"Install a Python script interpreter and configure the MariaDB database serverCreate a Python Script which enables an efficient connection to the MariaDB serverValidate the connection to the database by testing your script Mariadb Configuration, Mariadb installation, Command-Line Interface, Python installation, Python Scripting Learn step-by-step Information Technology",Python Database Connection with MariaDB From Infosys
Advanced MySQL Topics,"Add decision structures and functionality to a MySQL databases using SQL functions and operators on numbers and strings.Automate SQL by writing a stored procedure to solve real world problems . Database (DB) Design, Database (DBMS), MySQL Functions and triggers, Database optimization, MySQL for data analytics, Final project Information Technology",4.7,18.0,Intermediate,Coursera,"Incorporate decision-making structures and features into a MySQL database using SQL functions and operators for numbers and strings. Automate SQL tasks by creating stored procedures to address real-world issues. Topics covered include Database Design, Database Management Systems (DBMS), MySQL Functions and Triggers, Database Optimization, MySQL for Data Analytics, and the final project in Information Technology.",Advanced MySQL Topics
C Programming: Language Foundations - 2,"Use logical conditions to control the flow of a program via branch statements (if-else), repetition (for/while loop) and nesting of these structuresCreate and modify arrays to store integer and floating point numbers and explain how arrays are organized in memoryCreate null-terminated arrays of characters to store and modify strings (of characters)Sort and search arrays of numbers and characters using bubble sort, selection sort, linear search and bisection Computer Programming, C Programming Welcome, Week 1: Logic conditions and if-else statements, Week 2: Arrays, for and while loops, Week 3: Strings, sort and search algorithms, Concluding the course Information Technology",4.7,13.0,Beginner,Coursera,"Use logical conditions to control the flow of a program via branch statements (if-else), repetition (for/while loop) and nesting of these structures. Create and modify arrays to store integer and floating point numbers and explain how arrays are organized in memory. Create null-terminated arrays of characters to store and modify strings (of characters). Sort and search arrays of numbers and characters using bubble sort, selection sort, linear search and bisection. Computer Programming, C Programming Welcome, Week 1: Logic conditions and if-else statements, Week 2: Arrays, for and while loops, Week 3: Strings, sort and search algorithms, Concluding the course Information Technology.",C Programming: Language Foundations - 2
Getting started with Google Workspace Specialization,"Demonstrate the key features of Google Docs, Google Sheets, Google Slides, Google Calendar, Google Drive, Google Meet and Google ChatSecure, share and collaborate with others in Google WorkspaceConfigure Google Workspace to suit your way of workingSolve business challenges using Google Workspace Communication, Spreadsheet Software, Collaboration Gmail, Google Calendar, Google Drive, Google Docs, Google Sheets, Google Slides, Google Meet, Google Chat, Google Sheets - Advanced Topics Information Technology",4.8,40.0,Beginner,Coursera,"Demonstrate the key features of Google Docs, Google Sheets, Google Slides, Google Calendar, Google Drive, Google Meet and Google ChatSecure, share and collaborate with others in Google WorkspaceConfigure Google Workspace to suit your way of workingSolve business challenges using Google Workspace Communication, Spreadsheet Software, Collaboration Gmail, Google Calendar, Google Drive, Google Docs, Google Sheets, Google Slides, Google Meet, Google Chat, Google Sheets - Advanced Topics Information Technology",Getting started with Google Workspace Specialization
Security and Privacy for Big Data - Part 2,"Understand what data protection is and why this is important.Explain what personal data is, and know the essential facts about the GDPR, what the GDPR has changed compared to previous data protection law.Know privacy risks arising from Big Data applications and methods which reduce or prevent privacy risks of data processing activities. Know concepts like anonymization and pseudonymization, k-anonymity, differential privacy, secure multiparty computation, and homomorphic encryption. Not specified  SECURITY AND PRIVACY FOR BIG DATA - PART 2 Information Technology",4.7,1.0,Beginner,Coursera,"Understand what data protection is and why this is important.Explain what personal data is, and know the essential facts about the GDPR, what the GDPR has changed compared to previous data protection law.Know privacy risks arising from Big Data applications and methods which reduce or prevent privacy risks of data processing activities. Know concepts like anonymization and pseudonymization, k-anonymity, differential privacy, secure multiparty computation, and homomorphic encryption. Not specified  SECURITY AND PRIVACY FOR BIG DATA - PART 2 Information Technology",Security and Privacy for Big Data - Part 2
Compensation and Benefits,"Evaluate an organization's compensation strategyExplain different benefit types and optionsEvaluate and select an appropriate pay system for an organization's needs Benefit types, Compensation strategy, Pay systems, Total rewards Introduction to Compensation and Benefits, Organization Structure and Compensation Strategy, Benefits, Payroll and Benefit Technology and Design Information Technology",4.8,19.0,Beginner,Coursera,"Evaluate an organization's compensation strategyExplain different benefit types and optionsEvaluate and select an appropriate pay system for an organization's needs Benefit types, Compensation strategy, Pay systems, Total rewards Introduction to Compensation and Benefits, Organization Structure and Compensation Strategy, Benefits, Payroll and Benefit Technology and Design Information Technology",Compensation and Benefits
Cybersecurity Awareness and Innovation,"Cibersecurity awareness mainly focused on identity managementUnderstanding of effective protection mechanisms against common threats related with IdentityCapacity to devise disruptive ideas related with identity protection Not specified Identity and Authentication, Identity and social attacks, Protection basics for information and IT devices, The modern world: mobility and clouds, Cybersecurity Today and Challenges, Innovation & Entrepreneurship Information Technology",4.6,6.0,Beginner,Coursera,"Cibersecurity awareness mainly focused on identity managementUnderstanding of effective protection mechanisms against common threats related with IdentityCapacity to devise disruptive ideas related with identity protection Not specified Identity and Authentication, Identity and social attacks, Protection basics for information and IT devices, The modern world: mobility and clouds, Cybersecurity Today and Challenges, Innovation & Entrepreneurship Information Technology",Cybersecurity Awareness and Innovation
Estrategia de IT centrada en el cliente,"Not specified Sales, Project, strategy, Customer Satisfaction ¿Cómo defines una estrategia centrada en el cliente que puedas ejecutar en la práctica?, ¿Cómo puedes elaborar un prototipo de las soluciones de IT que las personas desean usar? Information Technology",0.0,2.0,Beginner,Coursera,"Not specified Sales, Project, strategy, Customer Satisfaction ¿Cómo defines una estrategia centrada en el cliente que puedas ejecutar en la práctica?, ¿Cómo puedes elaborar un prototipo de las soluciones de IT que las personas desean usar? Information Technology",Customer-centric IT strategy
Managing Relational Databases,"Students will learn to create and manage relational databases, and to use SQL for data analysis and reporting. Using Subqueries, Working with SQL Queries and Functions, Relational Database Concepts, Organizing Data, Manipulating Table Data Database Fundamentals, Multiple Conditions and Complex Criteria, Working with Functions, Retrieving and Organizing Data from Multiple Tables, Using Subqueries, Manipulating Table Data, Database Fundamentals Capstone Information Technology",0.0,17.0,Beginner,Coursera,"Students will learn to create and manage relational databases, and to use SQL for data analysis and reporting. Using Subqueries, Working with SQL Queries and Functions, Relational Database Concepts, Organizing Data, Manipulating Table Data Database Fundamentals, Multiple Conditions and Complex Criteria, Working with Functions, Retrieving and Organizing Data from Multiple Tables, Using Subqueries, Manipulating Table Data, Database Fundamentals Capstone Information Technology",Managing Relational Databases
Contact Center AI: Conversational Design Fundamentals,"Define what is Google CCAIExplain how Dialogflow can be used in Contact Center applicationsDescribe how NLU is used to enable Dialogflow conversationsCollaborate with a virtual agent developer on the design of chat and voice virtual agents Conversational design, Virtual agent Course Overview, Overview of Contact Center AI, Conversational Experiences, Fundamentals of Designing Conversations, Dialogflow Product Options, Course Review Information Technology",4.5,4.0,Beginner,Coursera,"Define what is Google CCAIExplain how Dialogflow can be used in Contact Center applicationsDescribe how NLU is used to enable Dialogflow conversationsCollaborate with a virtual agent developer on the design of chat and voice virtual agents Conversational design, Virtual agent Course Overview, Overview of Contact Center AI, Conversational Experiences, Fundamentals of Designing Conversations, Dialogflow Product Options, Course Review Information Technology",Contact Center AI: Conversational Design Fundamentals
Threat Analysis,"Not specified Not specified Understanding Incident Analysis in a Threat-Centric SOC, Identifying Common Attack Vectors, Identifying Malicious Activity, Identifying Patterns of Suspicious Behavior Information Technology",0.0,26.0,Not applicable,Coursera,"Not specified Not specified Understanding Incident Analysis in a Threat-Centric SOC, Identifying Common Attack Vectors, Identifying Malicious Activity, Identifying Patterns of Suspicious Behavior Information Technology",Threat Analysis
AI Essentials ,"Not specified AI Hardware, Customer Experience, AI Pipeline, B2B Sales, AI Software AI Essentials Information Technology",3.9,3.0,Beginner,Coursera,"Not specified AI Hardware, Customer Experience, AI Pipeline, B2B Sales, AI Software AI Essentials Information Technology",AI Essentials 
Fundamentals of Database Systems,"Describe database components.Investigate examples of database system diagrams.Use the Dia diagramming tool to add components to a database system diagram. Database Diagramming, Dia Learn step-by-step Information Technology",4.3,2.0,Intermediate,Coursera,"Describe database components.Investigate examples of database system diagrams.Use the Dia diagramming tool to add components to a database system diagram. Database Diagramming, Dia Learn step-by-step Information Technology",Fundamentals of Database Systems
