Course Title,Course Info,Course Rating,Course Duration,Course Level,Source,Course Info Translate,Course Title Translate
Introduction to AI in the Data Center,"What is AI and AI use cases, Machine Learning, Deep Leaning, and how training and inference happen in a Deep Learning Workflow.The history and architecture of GPUs,  how they differ from CPUs, and how they are revolutionizing AI.    Become familiar with deep learning frameworks, AI software stack, and considerations when deploying AI workloads on a data center on prem or cloud.Requirements for multi-system AI clusters and considerations for infrustructure planning, including servers, networking, storage and tools.  Artificial Intelligence (AI), Machine Learning Introduction to GPU Computing  |  NVIDIA Training, Rack Level Considerations | NVIDIA Training, Data Center Level Considerations | NVIDIA Training, Course Completion Quiz - Introduction to AI in the Data Center  Information Technology",4.7,5.0,Beginner,Coursera,"The text discusses AI, AI use cases, Machine Learning, Deep Learning, and how training and inference occur in a Deep Learning Workflow. It also covers the history and architecture of GPUs, how they differ from CPUs, and how they are changing AI. The text also touches on deep learning frameworks, AI software stack, and considerations for deploying AI workloads in a data center on-premises or in the cloud. It also discusses requirements for multi-system AI clusters and considerations for infrastructure planning, including servers, networking, storage, and tools. The text concludes with information on Artificial Intelligence (AI), Machine Learning Introduction to GPU Computing, NVIDIA Training, Rack Level Considerations, Data Center Level Considerations, and a Course Completion Quiz on Introduction to AI in the Data Center.",Introduction to AI in the Data Center
IBM Data Warehouse Engineer Professional Certificate,"Master the most up-to-date practical skills and knowledge data warehouse engineers use in their daily rolesLearn how to deploy, manage, secure, operationalize, monitor and optimize relational database systems like MySQL, PostgreSQL, and BD2Develop working knowledge of various types of SQL and queries to access and manipulate data in databasesDesign and populate data warehouses and analyze the data with Business Intelligence (BI) tools like Cognos Analytics Enterprise Data Warehouse (EDW), Data Science, Extract Transform Load (ETL), Postgresql, Database Architecture, Business Intelligence (BI), Relational Database (RDBMS), SQL, NoSQL, MySQL, Database (DBMS), database (DB) design Introduction to Data Engineering, Introduction to Relational Databases (RDBMS), SQL: A Practical Introduction for Querying Databases, Hands-on Introduction to Linux Commands and Shell Scripting, Relational Database Administration (DBA), ETL and Data Pipelines with Shell, Airflow and Kafka, Getting Started with Data Warehousing and BI Analytics, Data Warehousing Capstone Project Information Technology",4.7,120.0,Beginner,Coursera,"Master the most up-to-date practical skills and knowledge data warehouse engineers use in their daily rolesLearn how to deploy, manage, secure, operationalize, monitor and optimize relational database systems like MySQL, PostgreSQL, and BD2Develop working knowledge of various types of SQL and queries to access and manipulate data in databasesDesign and populate data warehouses and analyze the data with Business Intelligence (BI) tools like Cognos Analytics Enterprise Data Warehouse (EDW), Data Science, Extract Transform Load (ETL), Postgresql, Database Architecture, Business Intelligence (BI), Relational Database (RDBMS), SQL, NoSQL, MySQL, Database (DBMS), database (DB) design Introduction to Data Engineering, Introduction to Relational Databases (RDBMS), SQL: A Practical Introduction for Querying Databases, Hands-on Introduction to Linux Commands and Shell Scripting, Relational Database Administration (DBA), ETL and Data Pipelines with Shell, Airflow and Kafka, Getting Started with Data Warehousing and BI Analytics, Data Warehousing Capstone Project Information Technology",IBM Data Warehouse Engineer Professional Certificate
Command Line in Linux,"List files and directories using lsUse the cd command to change directoriesUse touch, copy, mkdir, and rm to create and remove files and directories Shell Commands, Command Line, Linux, Terminal, Bash Learn step-by-step Information Technology",4.6,1.0,Beginner,Coursera,"List files and directories using lsUse the cd command to change directoriesUse touch, copy, mkdir, and rm to create and remove files and directories Shell Commands, Command Line, Linux, Terminal, Bash Learn step-by-step Information Technology",Command Line in Linux
Data Engineering Foundations Specialization,"Working knowledge of Data Engineering Ecosystem and Lifecycle. Viewpoints and tips from Data professionals on starting a career in this domain.Python programming basics including data structures, logic, working with files, invoking APIs, using libraries such as Pandas and Numpy, doing ETL.Relational Database fundamentals including Database Design, Creating Schemas, Tables, Constraints, and working with MySQL, PostgreSQL & IBM Db2.SQL query language, SELECT, INSERT, UPDATE, DELETE statements, database functions, stored procs, working with multiple tables, JOINs, & transactions. Extraction, Transformation And Loading (ETL), Python Programming, Relational Database Management System (RDBMS), Information Engineering, SQL Introduction to Data Engineering, Python for Data Science, AI & Development, Python Project for Data Engineering, Introduction to Relational Databases (RDBMS), Databases and SQL for Data Science with Python Information Technology",4.7,80.0,Beginner,Coursera,"Working knowledge of Data Engineering Ecosystem and Lifecycle. Viewpoints and tips from Data professionals on starting a career in this domain.Python programming basics including data structures, logic, working with files, invoking APIs, using libraries such as Pandas and Numpy, doing ETL.Relational Database fundamentals including Database Design, Creating Schemas, Tables, Constraints, and working with MySQL, PostgreSQL & IBM Db2.SQL query language, SELECT, INSERT, UPDATE, DELETE statements, database functions, stored procs, working with multiple tables, JOINs, & transactions. Extraction, Transformation And Loading (ETL), Python Programming, Relational Database Management System (RDBMS), Information Engineering, SQL Introduction to Data Engineering, Python for Data Science, AI & Development, Python Project for Data Engineering, Introduction to Relational Databases (RDBMS), Databases and SQL for Data Science with Python Information Technology",Data Engineering Foundations Specialization
Build a free website with WordPress,"Open a free website on WordPress it and add pages to the website   Content Creation, Creativity, Web Page Learn step-by-step Information Technology",4.4,1.0,Intermediate,Coursera,"Open a free website on WordPress it and add pages to the website   Content Creation, Creativity, Web Page Learn step-by-step Information Technology",Build a free website with WordPress
Reliable Google Cloud Infrastructure: Design and Process,"Define application requirements and express as KPIs, SLOs, and SLIs.Build microservice applications and architect cloud and hybrid networks.Choose appropriate Google Cloud storage and deployment services.Secure cloud applications, data, and infrastructure, and monitor service levels. Disaster Recovery, Google Cloud Platform, Cloud Computing, Site Reliability Engineering Introduction, Defining Services, Microservice Design and Architecture, DevOps Automation, Choosing Storage Solutions, Google Cloud and Hybrid Network Architecture, Deploying Applications to Google Cloud, Designing Reliable Systems, Security, Maintenance and Monitoring Information Technology",4.7,8.0,Expert,Coursera,"Define application requirements and express as KPIs, SLOs, and SLIs.Build microservice applications and architect cloud and hybrid networks.Choose appropriate Google Cloud storage and deployment services.Secure cloud applications, data, and infrastructure, and monitor service levels. Disaster Recovery, Google Cloud Platform, Cloud Computing, Site Reliability Engineering Introduction, Defining Services, Microservice Design and Architecture, DevOps Automation, Choosing Storage Solutions, Google Cloud and Hybrid Network Architecture, Deploying Applications to Google Cloud, Designing Reliable Systems, Security, Maintenance and Monitoring Information Technology",Reliable Google Cloud Infrastructure: Design and Process
Azure: Create a Virtual Machine and Deploy a Web Server,"Familiarize youself with Azure basicsCreate a Virtual Machine and the surrounding network architectureUse Bastion to connect to the Virtual Machine and deploy a Nextcloud server Virtual Machine, Bastion, Azure, Virtual Networks Learn step-by-step Information Technology",4.5,2.0,Beginner,Coursera,"Familiarize youself with Azure basicsCreate a Virtual Machine and the surrounding network architectureUse Bastion to connect to the Virtual Machine and deploy a Nextcloud server Virtual Machine, Bastion, Azure, Virtual Networks Learn step-by-step Information Technology",Azure: Create a Virtual Machine and Deploy a Web Server
Getting Started with Power BI Desktop,"Import and Transform Data with Power BI DesktopVisualize Data with Power BI Desktop Business Intelligence, Data Analysis, Business Analytics, Data Visualization, power bi Learn step-by-step Information Technology",4.7,2.0,Beginner,Coursera,"Import and Transform Data with Power BI DesktopVisualize Data with Power BI Desktop Business Intelligence, Data Analysis, Business Analytics, Data Visualization, power bi Learn step-by-step Information Technology",Getting Started with Power BI Desktop
Amazon Translate: Translate documents with batch translation,"Translate a MS Word document using the Amazon Translate batch translation featureCreate a S3 Storage bucket to upload files & download translated filesCreate a batch translation job to translate documents such as Word, Excel & PPTs Amazon S3 Storage, amazon translate, Amazon Web Services (Amazon AWS), Translation, amazon batch text translation Learn step-by-step Information Technology",4.1,1.0,Beginner,Coursera,"Translate a MS Word document using the Amazon Translate batch translation featureCreate a S3 Storage bucket to upload files & download translated filesCreate a batch translation job to translate documents such as Word, Excel & PPTs Amazon S3 Storage, amazon translate, Amazon Web Services (Amazon AWS), Translation, amazon batch text translation Learn step-by-step Information Technology",Amazon Translate: Translate documents with batch translation
Cyber Security – Technology and Governance Specialization,"Some of the issues in computer security, including learning about components of computer systems, the operating system, programs, data and networkingKey security threats and risks faced in computer networks by gaining understanding of digital networks and their operationIntegrate incident management and a rich knowledge of people into a real-world Information Security Management System for an organisationNational and organisational cybersecurity culture, training, and other components which affect cybercriminal activity Computer Security Incident Management, Cybersecurity, Cyberattacks, Information Security (INFOSEC) Introduction to Computer Security, Introduction to Network Security, Security Management and Governance, Cybercrime Information Technology",5.0,80.0,Beginner,Coursera,"Some of the issues in computer security, including learning about components of computer systems, the operating system, programs, data and networkingKey security threats and risks faced in computer networks by gaining understanding of digital networks and their operationIntegrate incident management and a rich knowledge of people into a real-world Information Security Management System for an organisationNational and organisational cybersecurity culture, training, and other components which affect cybercriminal activity Computer Security Incident Management, Cybersecurity, Cyberattacks, Information Security (INFOSEC) Introduction to Computer Security, Introduction to Network Security, Security Management and Governance, Cybercrime Information Technology",Cyber Security – Technology and Governance Specialization
Introduction to Relational Databases (RDBMS),"Describe data, databases, relational databases, and cloud databases.Describe information and data models, relational databases, and relational model concepts (including schemas and tables). Explain an Entity Relationship Diagram and design a relational database for a specific use case.Develop a working knowledge of popular DBMSes including MySQL, PostgreSQL, and IBM DB2 Database (DB) Design, Postgresql, Relational Database Management System (RDBMS), Database Architecture, MySQL Relational Database Concepts, Using Relational Databases, MySQL and PostgreSQL, Course Assignment Information Technology",4.6,21.0,Beginner,Coursera,"Describe data, databases, relational databases, and cloud databases.Describe information and data models, relational databases, and relational model concepts (including schemas and tables). Explain an Entity Relationship Diagram and design a relational database for a specific use case.Develop a working knowledge of popular DBMSes including MySQL, PostgreSQL, and IBM DB2 Database (DB) Design, Postgresql, Relational Database Management System (RDBMS), Database Architecture, MySQL Relational Database Concepts, Using Relational Databases, MySQL and PostgreSQL, Course Assignment Information Technology",Introduction to Relational Databases (RDBMS)
Security and Privacy for Big Data - Part 1,Recognize all security related issues in big data systems and projects.Define cryptographic principles and mechanisms to manage access controls in your Big Data system.Explain security risks and challenges for Big Data system.   Not specified SECURITY AND PRIVACY FOR BIG DATA - PART 1 Information Technology,4.7,1.0,Beginner,Coursera,Recognize all security related issues in big data systems and projects.Define cryptographic principles and mechanisms to manage access controls in your Big Data system.Explain security risks and challenges for Big Data system.   Not specified SECURITY AND PRIVACY FOR BIG DATA - PART 1 Information Technology,Security and Privacy for Big Data - Part 1
Introduction to Data Networks and the Internet - Bachelor's,"Not specified Protocol Implementation, Network Monitoring and Security, Network Communication Module 1: Introduction to Network Concepts, Module 2: OSI, TCP, and Network Addressing, Module 3: Network Installation and Configuration, Module 4: Network Management, Module 5: Network Security Concepts, Module 6: Network Analysis, Module 7: Network Troubleshooting, Module 8: Software Defined Networks and the Cloud, Course Summative Assessment Information Technology",0.0,61.0,Beginner,Coursera,The text is already in English.,Introduction to Data Networks and the Internet - Bachelor's
Develop a free website with WordPress,"add pages and posts to the website on WordPress and create content for the posts. Content Creation, Creativity, Social Media Platforms Learn step-by-step Information Technology",4.2,1.0,Intermediate,Coursera,"add pages and posts to the website on WordPress and create content for the posts. Content Creation, Creativity, Social Media Platforms Learn step-by-step Information Technology",Develop a free website with WordPress
The Bits and Bytes of Computer Networking,"Not specified Domain Name System (DNS), Ipv4, Network Model, Troubleshooting Introduction to Networking, The Network Layer, The Transport and Application Layers, Networking Services, Connecting to the Internet, Troubleshooting and the Future of Networking Information Technology",4.7,27.0,Beginner,Coursera,"No se especifica Sistema de Nombres de Dominio (DNS), Ipv4, Modelo de Red, Introducción a la Resolución de Problemas de Redes, La Capa de Red, Las Capas de Transporte y Aplicación, Servicios de Redes, Conexión a Internet, Resolución de Problemas y el Futuro de la Tecnología de la Información en Red.",The Bits and Bytes of Computer Networking
Introduction to Cloud Computing,"Define cloud computing and explain essential characteristics, history, the business case for cloud, and the emerging technologies enabled by cloudDescribe the cloud service models- IaaS, PaaS, SaaS, and cloud deployment models- Public, Private, Hybrid; explain cloud infrastructure componentsExplain emerging Cloud related trends including HybridMulticloud, Microservices, Serverless, Cloud Native, DevOps, and Application ModernizationList and describe services of popular cloud platforms including AWS, Microsoft Azure, Google Cloud, IBM Cloud, Alibaba Cloud, and others Cloud Computing, Hybrid Multicloud, Devops, Iaas PaaS Saas, Cloud Native Overview of Cloud Computing, Cloud Computing Models, Components of Cloud Computing, Emergent Trends and Practices, Cloud Security, Monitoring, Case Studies,  Jobs , Final Project and Assignment Information Technology",4.6,12.0,Beginner,Coursera,"Define cloud computing and explain essential characteristics, history, the business case for cloud, and the emerging technologies enabled by cloud. Describe the cloud service models - IaaS, PaaS, SaaS, and cloud deployment models - Public, Private, Hybrid; explain cloud infrastructure components. Explain emerging Cloud related trends including Hybrid Multicloud, Microservices, Serverless, Cloud Native, DevOps, and Application Modernization. List and describe services of popular cloud platforms including AWS, Microsoft Azure, Google Cloud, IBM Cloud, Alibaba Cloud, and others. Cloud Computing, Hybrid Multicloud, Devops, IaaS, PaaS, SaaS, Cloud Native Overview of Cloud Computing, Cloud Computing Models, Components of Cloud Computing, Emergent Trends and Practices, Cloud Security, Monitoring, Case Studies, Jobs, Final Project and Assignment Information Technology.",Introduction to Cloud Computing
Introduction to Generative AI ,Define Generative AIExplain how Generative AI worksDescribe Generative AI Model TypesDescribe Generative AI Applications Not specified Introduction to Generative AI  Information Technology,4.6,1.0,Beginner,Coursera,Define Generative AIExplain how Generative AI worksDescribe Generative AI Model TypesDescribe Generative AI Applications Not specified Introduction to Generative AI  Information Technology,Introduction to Generative AI 
Computer Forensics Specialization,"The student will learn about digital forensics concepts.The student will understand concepts about Windows OS forensics.The Student will be able to apply new forensics concepts for the Windows Registry. forensics, collecting digital evidence, windows os, windows registry, Hashing Digital Forensics Concepts, Windows OS Forensics, Windows Registry Forensics Information Technology",4.8,40.0,Intermediate,Coursera,"The student will learn about digital forensics concepts.The student will understand concepts about Windows OS forensics.The Student will be able to apply new forensics concepts for the Windows Registry. forensics, collecting digital evidence, windows os, windows registry, Hashing Digital Forensics Concepts, Windows OS Forensics, Windows Registry Forensics Information Technology",Computer Forensics Specialization
Operating Systems and You: Becoming a Power User,"Not specified Powershell, Linux File Systems, Command-Line Interface, Linux Navigating the System, Users and Permissions, Package and Software Management, Filesystems, Process Management, Operating Systems in Practice Information Technology",4.7,36.0,Beginner,Coursera,"Not specified Powershell, Linux File Systems, Command-Line Interface, Linux Navigating the System, Users and Permissions, Package and Software Management, Filesystems, Process Management, Operating Systems in Practice Information Technology",Operating Systems and You: Becoming a Power User
Computer Networking,"Compare and contrast Transmission Control Protocol (TCP) and User Datagram Protocol (UDP) ports, protocols, and their purposes.Analyze and compare common networking hardware.Compare and contrast protocols for wireless networking. Not specified Module 1: Network Hardware, Module 2: Protocols, Module 3: Wireless Technology, Summative Course Assessment Information Technology",4.2,25.0,Beginner,Coursera,"Compare and contrast Transmission Control Protocol (TCP) and User Datagram Protocol (UDP) ports, protocols, and their purposes.Analyze and compare common networking hardware.Compare and contrast protocols for wireless networking. Not specified Module 1: Network Hardware, Module 2: Protocols, Module 3: Wireless Technology, Summative Course Assessment Information Technology",Computer Networking
Introduction to Cybersecurity Tools & Cyber Attacks,"Discuss the evolution of security based on historical events.  List various types of malicious software.  Describe key cybersecurity concepts including the CIA Triad, access management, incident response and common cybersecurity best practices.  Identify key cybersecurity tools which include the following:  firewall, anti-virus, cryptography, penetration testing and digital forensics.     Malware, Cybersecurity, Information Security (INFOSEC), IBM New Collar, Cyber Attacks History of Cybersecurity, A brief overview of types of actors and their motives, An overview of key security concepts, An overview of key security tools Information Technology",4.6,18.0,Beginner,Coursera,"Discuss the evolution of security based on historical events.  List various types of malicious software.  Describe key cybersecurity concepts including the CIA Triad, access management, incident response and common cybersecurity best practices.  Identify key cybersecurity tools which include the following:  firewall, anti-virus, cryptography, penetration testing and digital forensics.     Malware, Cybersecurity, Information Security (INFOSEC), IBM New Collar, Cyber Attacks History of Cybersecurity, A brief overview of types of actors and their motives, An overview of key security concepts, An overview of key security tools Information Technology",Introduction to Cybersecurity Tools & Cyber Attacks
Introduction to Networking,"You will learn what a network is and why it is needed.Describe the network components and provide the requirements for a networking solution.Introduce the OSI model and the TCP/IP protocol suite and their role in networking.Cover the basics of Ethernet technology and understand how data is forwarded in an Ethernet network. Not specified Introduction , Course Completion Quiz - Introduction to Networking Information Technology",4.4,1.0,Beginner,Coursera,"You will learn what a network is and why it is needed.Describe the network components and provide the requirements for a networking solution.Introduce the OSI model and the TCP/IP protocol suite and their role in networking.Cover the basics of Ethernet technology and understand how data is forwarded in an Ethernet network. Not specified Introduction , Course Completion Quiz - Introduction to Networking Information Technology",Introduction to Networking
Big Data Emerging Technologies,"Not specified Not specified Big Data Rankings & Products, Big Data & Hadoop, Spark, Spark ML & Streaming, Storm, IBM SPSS Statistics Project Information Technology",4.7,29.0,Beginner,Coursera,"No especificado No especificado Clasificaciones y Productos de Big Data, Big Data y Hadoop, Spark, Spark ML y Streaming, Storm, Proyecto de Estadísticas de IBM SPSS Tecnología de la Información",Big Data Emerging Technologies
Introduction to Quantum Information,"Not specified Not specified Quantum Theory to Information Technologies, Single qubit, Bipartite quantum systems, Quantum computing, Quantum communication, Entanglement, Summary Information Technology",4.2,11.0,Expert,Coursera,"Not specified Not specified Quantum Theory to Information Technologies, Single qubit, Bipartite quantum systems, Quantum computing, Quantum communication, Entanglement, Summary Information Technology",Introduction to Quantum Information
IoT (Internet of Things) Wireless & Cloud Computing Emerging Technologies,"Not specified Not specified IoT Business & Products, IoT Architecture & Technologies, IoT Networks, Wi-Fi & Bluetooth, Cloud Technology, IoT Bluetooth & Wi-Fi and EC2 Cloud Projects Information Technology",4.7,12.0,Beginner,Coursera,"Not specified Not specified IoT Business & Products, IoT Architecture & Technologies, IoT Networks, Wi-Fi & Bluetooth, Cloud Technology, IoT Bluetooth & Wi-Fi and EC2 Cloud Projects Information Technology",IoT (Internet of Things) Wireless & Cloud Computing Emerging Technologies
IT Fundamentals for Cybersecurity Specialization,"Not specified networking basics, Cybersecurity, database vulnerabilities, Operating System Security, Cyber Attacks Introduction to Cybersecurity Tools & Cyber Attacks, Cybersecurity Roles, Processes & Operating System Security, Cybersecurity Compliance Framework & System Administration, Network Security & Database Vulnerabilities  Information Technology",4.6,80.0,Beginner,Coursera,"Not specified networking basics, Cybersecurity, database vulnerabilities, Operating System Security, Cyber Attacks Introduction to Cybersecurity Tools & Cyber Attacks, Cybersecurity Roles, Processes & Operating System Security, Cybersecurity Compliance Framework & System Administration, Network Security & Database Vulnerabilities  Information Technology",IT Fundamentals for Cybersecurity Specialization
