Course Title,Course Info,Course Rating,Course Duration,Course Level,Source,Course Info Translate,Course Title Translate
Additive Manufacturing,"Understand the basics of Additive Manufacturing and industrial applicationsLearn about business considerations around implementing Additive Manufacturing Bussiness, 3D printing, Manufacturing Ecosystem, Additive manufacturing, technology What is Additive Manufacturing?, Business Context of Additive Manufacturing, Future Trend, Course Summary, and Series Conclusion Information Technology",4.7,12.0,Beginner,Coursera,"Understand the basics of Additive Manufacturing and industrial applicationsLearn about business considerations around implementing Additive Manufacturing Bussiness, 3D printing, Manufacturing Ecosystem, Additive manufacturing, technology What is Additive Manufacturing?, Business Context of Additive Manufacturing, Future Trend, Course Summary, and Series Conclusion Information Technology",Additive Manufacturing
Networking in Google Cloud: Defining and Implementing Networks,"Configure Google VPC networks, subnets, and routers and control administrative access to VPC objects.Route traffic by using DNS traffic steering.Choose among Google Cloud load balancer and proxy options and configure themImplement network connectivity between Google Cloud projects. Not specified Module 0: Welcome to Networking in Google Cloud: Defining and Implementing Networks\t, Google Cloud VPC Networking Fundamentals, Controlling Access to VPC Networks, Sharing Networks across Projects, Load Balancing, Course Resources Information Technology",4.8,7.0,Intermediate,Coursera,"Configure Google VPC networks, subnets, and routers and control administrative access to VPC objects.Route traffic by using DNS traffic steering.Choose among Google Cloud load balancer and proxy options and configure themImplement network connectivity between Google Cloud projects. Not specified Module 0: Welcome to Networking in Google Cloud: Defining and Implementing Networks\t, Google Cloud VPC Networking Fundamentals, Controlling Access to VPC Networks, Sharing Networks across Projects, Load Balancing, Course Resources Information Technology",Networking in Google Cloud: Defining and Implementing Networks
Advanced Network Security Specialization,"Not specified Cloud Management Next-Generation Firewalls and Intrusion Prevention, Securing Cloud and Hybrid Networks, Advanced Threat Hunting and Incident Response Information Technology",0.0,80.0,Expert,Coursera,"The text translates to:

""Cloud Management Next-Generation Firewalls and Intrusion Prevention, Securing Cloud and Hybrid Networks, Advanced Threat Hunting and Incident Response Information Technology""",Advanced Network Security Specialization
Deploying SAP on Google Cloud,"Describe Google Cloud Services that are important to design robust, performant & resilient infrastructure for running SAP workloads on Google CloudIdentify the guidelines and best practices for SAP deployments on Google CloudDescribe the reference architectures for High Availability for SAP systems in Google Cloud.Deploy an SAP HANA single-host, high-availability cluster Not specified Welcome to Deploying SAP on Google Cloud, Google Cloud Services for SAP Deployments: Part 1, Google Cloud Services for SAP Deployments: Part 2, Guidelines for SAP Deployments on Google Cloud, Architecting SAP on Google Cloud - High Availability, Architecting SAP on Google Cloud - Disaster Recovery & Data Management, SAP on Bare Metal Solution, Course Summary Information Technology",4.6,4.0,Beginner,Coursera,"Describe Google Cloud Services that are important to design robust, performant & resilient infrastructure for running SAP workloads on Google CloudIdentify the guidelines and best practices for SAP deployments on Google CloudDescribe the reference architectures for High Availability for SAP systems in Google Cloud.Deploy an SAP HANA single-host, high-availability cluster Not specified Welcome to Deploying SAP on Google Cloud, Google Cloud Services for SAP Deployments: Part 1, Google Cloud Services for SAP Deployments: Part 2, Guidelines for SAP Deployments on Google Cloud, Architecting SAP on Google Cloud - High Availability, Architecting SAP on Google Cloud - Disaster Recovery & Data Management, SAP on Bare Metal Solution, Course Summary Information Technology",Deploying SAP on Google Cloud
Intro to Operating Systems 1: Virtualization,"Foundational principles of virtualization within operating systems, particularly with respect to processes and memory management.Expertise in the C language and its significance in operating system design and functionality. C Programming, Operating Systems, Scheduling Algorithms Introduction, Processes and Execution, Scheduling, Memory Information Technology",4.7,8.0,Intermediate,Coursera,The text is already in English.,Intro to Operating Systems 1: Virtualization
Information Visualization: Foundations,"Not specified Not specified Introduction to Information Visualization, Data Abstraction, Fundamental Graphs and Data Transformation, Graphical Components and Mapping Strategies Information Technology",4.5,11.0,Beginner,Coursera,The text is already in English.,Information Visualization: Foundations
Data Analytics and Databases on AWS,"Key data types and structuresAWS services for the ETL processHands-on skills for Amazon API Gateway and Amazon QuickSight Extraction, Transformation And Loading (ETL), Data Analysis, Database (DBMS), Data Architecture, Data Warehouse Module 1: Foundations of Data Analysis, Module 2: ETL Pipeline and Database Foundations, Module 3: AWS Services for ETL Information Technology",0.0,9.0,Beginner,Coursera,"Key data types and structuresAWS services for the ETL processHands-on skills for Amazon API Gateway and Amazon QuickSight Extraction, Transformation And Loading (ETL), Data Analysis, Database (DBMS), Data Architecture, Data Warehouse Module 1: Foundations of Data Analysis, Module 2: ETL Pipeline and Database Foundations, Module 3: AWS Services for ETL Information Technology

Translation: This text discusses key data types and structures, AWS services for the ETL process, hands-on skills for Amazon API Gateway and Amazon QuickSight, Extraction, Transformation, and Loading (ETL), Data Analysis, Database (DBMS), Data Architecture, Data Warehouse. It also includes Module 1: Foundations of Data Analysis, Module 2: ETL Pipeline and Database Foundations, Module 3: AWS Services for ETL in Information Technology.",Data Analytics and Databases on AWS
Introduction to Data Networks and the Internet - Master's,"Not specified Protocol Implementation, Network Monitoring and Security, Networking communication Module 1: Introduction to Network Concepts, Module 2: OSI, TCP, and Network Addressing, Module 3: Network Installation and Configuration, Module 4: Network Management, Module 5: Network Security Concepts, Module 6: Network Analysis, Module 7: Network Troubleshooting, Module 8: Software Defined Networks and the Cloud, Course Summative Assessment Information Technology",0.0,63.0,Beginner,Coursera,The text is already in English.,Introduction to Data Networks and the Internet - Master's
Cybersecurity Architecture,"Describe the five foundational principles of cybersecurity and the Confidentiality, Integrity, and Availability (CIA) triadSummarize the different areas that a cybersecurity architect must adopt to develop a secure enterprise solutionDiscuss the different security domains, including IAM, endpoint security, network security, application security, and data securityDemonstrate your proficiency in recommending methods to improve network security in a given scenario Cybersecurity, Network Security, Data Security, Digital Network Architecture, Application Security Cybersecurity Architecture Overview, Access Management and Endpoint Security, Network, Application, and Data Security, Detection and Response, Final Project, Exam, and Course Wrap-Up Information Technology",0.0,12.0,Intermediate,Coursera,"Describe the five foundational principles of cybersecurity and the Confidentiality, Integrity, and Availability (CIA) triadSummarize the different areas that a cybersecurity architect must adopt to develop a secure enterprise solutionDiscuss the different security domains, including IAM, endpoint security, network security, application security, and data securityDemonstrate your proficiency in recommending methods to improve network security in a given scenario Cybersecurity, Network Security, Data Security, Digital Network Architecture, Application Security Cybersecurity Architecture Overview, Access Management and Endpoint Security, Network, Application, and Data Security, Detection and Response, Final Project, Exam, and Course Wrap-Up Information Technology",Cybersecurity Architecture
Introduction to AWS Cloud Careers,"Describe IT and cloud computing.Assess in-demand cloud computing roles.Analyze your current skills and the skills you might want to gain in the  cloud computing field.  Solution Architecture, Cloud Computing, Developing on AWS, Cloud Operations, AWS cloud Week 1, Week 2 Information Technology",4.7,4.0,Beginner,Coursera,"Describe IT and cloud computing.Assess in-demand cloud computing roles.Analyze your current skills and the skills you might want to gain in the  cloud computing field.  Solution Architecture, Cloud Computing, Developing on AWS, Cloud Operations, AWS cloud Week 1, Week 2 Information Technology",Introduction to AWS Cloud Careers
WhatsApp Business Platform for Developers,"Implement the WhatsApp Business Platform and WhatsApp Business Management APICreate templates, send and receive messages using the Cloud API, hosted by Meta Configure webhooks, Create message templates, Set up API access The WhatsApp Business Platform, Set Up the WhatsApp Business Platform, Implement the WhatsApp Business Platform, The WhatsApp Business Management API Information Technology",4.5,16.0,Intermediate,Coursera,"Implement the WhatsApp Business Platform and WhatsApp Business Management APICreate templates, send and receive messages using the Cloud API, hosted by Meta Configure webhooks, Create message templates, Set up API access The WhatsApp Business Platform, Set Up the WhatsApp Business Platform, Implement the WhatsApp Business Platform, The WhatsApp Business Management API Information Technology",WhatsApp Business Platform for Developers
Automation with Ansible," Demonstrate working of portal that acts as a central repository for sharing, reusing and locating Ansible-related Content   Explore Ansible's components such as its ease of deployment, learning and debugging   Overview of Ansible Playbooks, which is a YAML based automation tool that developers can use to automate various tasks.Elaborate Automation with Ansible for remote clients in order to explain Ansible inventory files IaC, Linux, Devops, Ansible Course Introduction and Setting up Ansible, Automation with Ansible-Part 1, Automation with Ansible-Part 2 Information Technology",0.0,5.0,Beginner,Coursera," Demonstrate working of portal that acts as a central repository for sharing, reusing and locating Ansible-related Content   Explore Ansible's components such as its ease of deployment, learning and debugging   Overview of Ansible Playbooks, which is a YAML based automation tool that developers can use to automate various tasks.Elaborate Automation with Ansible for remote clients in order to explain Ansible inventory files IaC, Linux, Devops, Ansible Course Introduction and Setting up Ansible, Automation with Ansible-Part 1, Automation with Ansible-Part 2 Information Technology",Automation with Ansible
Exam Prep AZ-500:Microsoft Azure Security Engineer Associate Specialization,"Gain Skills to understand the Azure Security Engineer Associate CertificateLearn working with various Azure Services necessary for Associate Level Database Security, Storage Security, Virtual Machine, Network Security, Azure Monitoring, Azure Storage Accounts, Virtual Networks, Kubernetes, Containers, Microsoft Permissions Management, Azure SQL DB Azure: Identity and Access Management, Azure: Network Security, Azure: Compute, Storage, and Database Security, Azure: Security Operations Management Information Technology",0.0,48.0,Intermediate,Coursera,"Gain Skills to understand the Azure Security Engineer Associate CertificateLearn working with various Azure Services necessary for Associate Level Database Security, Storage Security, Virtual Machine, Network Security, Azure Monitoring, Azure Storage Accounts, Virtual Networks, Kubernetes, Containers, Microsoft Permissions Management, Azure SQL DB Azure: Identity and Access Management, Azure: Network Security, Azure: Compute, Storage, and Database Security, Azure: Security Operations Management Information Technology",Exam Prep AZ-500:Microsoft Azure Security Engineer Associate Specialization
"Nanotechnology and Nanosensors, Part 2","Not specified Not specified Nanowire-based Sensors, Carbon Nanotube-based Sensors, Sensors based on Nanostructures of Metal Oxide, Sensors based on Polymeric Nanostructures, Electronic Skin Based on Nanotechnology Information Technology",4.8,16.0,Not applicable,Coursera,"Not specified Not specified Nanowire-based Sensors, Carbon Nanotube-based Sensors, Sensors based on Nanostructures of Metal Oxide, Sensors based on Polymeric Nanostructures, Electronic Skin Based on Nanotechnology Information Technology","Nanotechnology and Nanosensors, Part 2"
A Strategic Approach to Cybersecurity,"Not specified Not specified Defining a Strategic Approach to Cybersecurity (Week 1), Private Sector Context - Part 1 (Week 2), Private Sector Context - Part 2 (Week 3), Public Sector Context: Critical Infrastructure and National Response (Week 4), Protecting National Critical Functions (Week 5), From Device to National Critical Function: Identifying Strategic Consequence (Week 6) Information Technology",4.8,9.0,Beginner,Coursera,The text is already in English.,A Strategic Approach to Cybersecurity
"HI-FIVE: Health Informatics For Innovation, Value & Enrichment (Clinical Perspective)","Not specified Health Informatics, Value-Based Pricing, Communication, Management Course and Case Introduction, Mr. Osner Santana Goes to the ED, Mr. Osner Santana Waits to Be Seen, Mr. Osner Santana Meets Dr. Jefferson (Part 1), Mr. Osner Santana Meets Dr. Jefferson (Part 2), Completion of HI-FIVE Training (Clinical Perspective), Role-Based Content (OPTIONAL) - Physicians / Nurse Practitioners / Physician Assistants / Clinical Executives / Clinical Managers / Public Health Professionals, Role-Based Content (OPTIONAL) - Nurses / Midwives / Medical Assistants / Other Clinical Support Information Technology",4.6,41.0,Beginner,Coursera,"Health Informatics, Value-Based Pricing, Communication, Management Course and Case Introduction, Mr. Osner Santana Goes to the ED, Mr. Osner Santana Waits to Be Seen, Mr. Osner Santana Meets Dr. Jefferson (Part 1), Mr. Osner Santana Meets Dr. Jefferson (Part 2), Completion of HI-FIVE Training (Clinical Perspective), Role-Based Content (OPTIONAL) - Physicians / Nurse Practitioners / Physician Assistants / Clinical Executives / Clinical Managers / Public Health Professionals, Role-Based Content (OPTIONAL) - Nurses / Midwives / Medical Assistants / Other Clinical Support Information Technology","HI-FIVE: Health Informatics For Innovation, Value & Enrichment (Clinical Perspective)"
IBM Data Privacy for Information Architecture,"Not specified Information Privacy, IBM datafirst method IBM DataFirst Data Privacy introduction, Data governance and organizational structures, Dealing with regulation, Data governance intersections, Data privacy vs security, Data privatization mechanisms, Conducting the workshop Information Technology",4.6,10.0,Not applicable,Coursera,"Not specified Information Privacy, IBM datafirst method IBM DataFirst Data Privacy introduction, Data governance and organizational structures, Dealing with regulation, Data governance intersections, Data privacy vs security, Data privatization mechanisms, Conducting the workshop Information Technology",IBM Data Privacy for Information Architecture
Juniper Networks Junos Platform Automation and DevOps Specialization,"Not specified Internet, Networking, Devops, networks, Automation Juniper Networks Junos Automation Basics and XML, Juniper Networks Automation Using Python and PyEZ, Juniper Networks Automation Using Ansible and the REST API  Information Technology",4.2,40.0,Beginner,Coursera,"Not specified Internet, Networking, Devops, networks, Automation Juniper Networks Junos Automation Basics and XML, Juniper Networks Automation Using Python and PyEZ, Juniper Networks Automation Using Ansible and the REST API  Information Technology",Juniper Networks Junos Platform Automation and DevOps Specialization
Working with Version Control,"Describe the meaning and purpose of version control, understanding its role in managing and tracking changes in software development projects. Identify the benefits for developers when using version control.  Learn to generate/ utilise SSH keys, use basic Git commands, access public repositories, set up project boards and use issue trackers.Leverage Github's markdown language for formatting text and bios.  Version Control, Coding, Markdown Week 1: Introduction to version control, Week 2: Documenting with Markdown, Week 3. Using GitHub Projects and Issue Tracker Information Technology",0.0,8.0,Beginner,Coursera,"Describe the meaning and purpose of version control, understanding its role in managing and tracking changes in software development projects. Identify the benefits for developers when using version control.  Learn to generate/ utilise SSH keys, use basic Git commands, access public repositories, set up project boards and use issue trackers.Leverage Github's markdown language for formatting text and bios.  Version Control, Coding, Markdown Week 1: Introduction to version control, Week 2: Documenting with Markdown, Week 3. Using GitHub Projects and Issue Tracker Information Technology",Working with Version Control
Application Modernization for Enterprise Systems,"Not specified Computer Programming, Event (Computing), Devops, Cloud API Why Application Modernization for Mainframe?, Application Discovery, Implement Enterprise DevOps and API Management, Colocate applications, modern access to data, respond to events, and optimized CQRS Information Technology",0.0,3.0,Beginner,Coursera,The text is already in English.,Application Modernization for Enterprise Systems
How to Modernize applications with IBM CICS,"Understand why CICS is perfect for powering the next generation of enterprise applicationsExperience writing, updating and running CICS applicationsModernize these applications to run as part of a hybrid cloud application Customer Information Control System (CICS), Application Programming Interfaces (API), IT Architect, IBM Z, Developer CICS Application Programming Fundamentals, Programming and Modernizing CICS COBOL Applications, Additional Modernization Technologies and Techniques, Final Quiz Information Technology",0.0,2.0,Intermediate,Coursera,"Understand why CICS is perfect for powering the next generation of enterprise applicationsExperience writing, updating and running CICS applicationsModernize these applications to run as part of a hybrid cloud application Customer Information Control System (CICS), Application Programming Interfaces (API), IT Architect, IBM Z, Developer CICS Application Programming Fundamentals, Programming and Modernizing CICS COBOL Applications, Additional Modernization Technologies and Techniques, Final Quiz Information Technology",How to Modernize applications with IBM CICS
"HI-FIVE: Health Informatics For Innovation, Value & Enrichment (Administrative/IT Perspective)","Not specified Health Informatics, Value-Based Pricing, Data Analysis, Analytics Course and Case Introduction, Meeting the Heights Family Healthcare Clinic Team (Part 1), Meeting the Heights Family Healthcare Clinic Team (Part 2), Getting Mr. Santana to His Appointment, Achieving Coordinated, Team-Based Care, Completion of HI-FIVE Training (Administrative/IT Perspective) Information Technology",4.6,14.0,Beginner,Coursera,"No especificado Informática de la Salud, Precios Basados en el Valor, Análisis de Datos, Curso y Presentación de Casos de Analítica, Reunión con el Equipo de la Clínica de Atención Médica Familiar Heights (Parte 1), Reunión con el Equipo de la Clínica de Atención Médica Familiar Heights (Parte 2), Llevando al Sr. Santana a su cita, Logrando una Atención Coordinada y Basada en Equipos, Finalización del Entrenamiento HI-FIVE (Perspectiva Administrativa/TI) Tecnología de la Información","HI-FIVE: Health Informatics For Innovation, Value & Enrichment (Administrative/IT Perspective)"
Cloud Computing Primer: Software as a Service (SaaS),"Describe at least three advantages and disadvantages of cloud computingProvide a strategy on how an ISV can utilize SaaS to promote their growthExplore the application of a SaaS cloud computing model through a demo engagement Cloud Applications, Software As A Service (SAAS), Cloud Computing Cloud Computing Primer, SaaS Considerations & Expansion, SaaS Applications & Adoption, SaaS Demo Information Technology",4.6,6.0,Beginner,Coursera,"Advantages of cloud computing include cost savings, scalability, and flexibility. Disadvantages include security concerns, dependency on internet connectivity, and potential downtime.

An ISV can utilize SaaS to promote their growth by offering subscription-based services, reaching a wider audience, and providing regular updates and improvements to their software.

To explore the application of a SaaS cloud computing model through a demo engagement, the ISV can showcase the benefits of their software through a trial version, provide training and support to potential customers, and gather feedback for further enhancements.",Cloud Computing Primer: Software as a Service (SaaS)
Estrutura e Funcionamento das Redes de Computadores,"Not specified Ipv4, Resolução de problemas, Modelo de rede, Sistema de Nomes de Domínio (DNS) Introdução a redes, A CAMADA DE REDE, As camadas de transporte e aplicação, Serviços de redes, Conexão com a Internet, Solução de problemas e o futuro das redes Information Technology",4.9,30.0,Beginner,Coursera,"Not specified Ipv4, Troubleshooting, Network Model, Domain Name System (DNS) Introduction to Networks, NETWORK LAYER, Transport and Application Layers, Network Services, Internet Connection, Troubleshooting, and the Future of Networks Information Technology",Structure and Functioning of Computer Networks
Making the Case for Robotic Process Automation,"Not specified Not specified Making the Case for Robotic Process Automation, Building An RPA Business Case Information Technology",4.1,5.0,Not applicable,Coursera,"Not specified Not specified Making the Case for Robotic Process Automation, Building An RPA Business Case Information Technology",Making the Case for Robotic Process Automation
Getting Started with Azure,"Navigating the Azure Portal and Creating Custom DahboardsDeploying Virtual Machines Cloud Security, including Network Security Groups, Firewall and Resource PoliciesAzure Cloud Resource Groups and Storage Options Cloud Platforms, Microsoft Azure, Cloud Management, Cloud Databases, Cloud Computing Navigating Azure Tools and Services, Deploying Virtual Machines (VMs), Azure Network Security, Deploying an Azure Network, Firewall Configurations and Resource Groups, Storage Information Technology",4.4,20.0,Beginner,Coursera,"Navigating the Azure Portal and Creating Custom DahboardsDeploying Virtual Machines Cloud Security, including Network Security Groups, Firewall and Resource PoliciesAzure Cloud Resource Groups and Storage Options Cloud Platforms, Microsoft Azure, Cloud Management, Cloud Databases, Cloud Computing Navigating Azure Tools and Services, Deploying Virtual Machines (VMs), Azure Network Security, Deploying an Azure Network, Firewall Configurations and Resource Groups, Storage Information Technology",Getting Started with Azure
Advanced Python - Reconnaissance,"Not specified Not specified Introduction to Advanced Python for Cybersecurity, Performing Reconnaissance, Gaining Initial Access Information Technology",4.5,3.0,Not applicable,Coursera,This text is already in English.,Advanced Python - Reconnaissance
 Les bits et les octets des réseaux informatiques,"Not specified Dépannage, Ipv4, modèle de réseau, Système de noms de domaine (DNS) Introduction réseaux informatiques, La couche réseau, Les couches de transport et d’application, Services réseau, Connexion à Internet, Dépannage et avenir des réseaux Information Technology",4.8,33.0,Beginner,Coursera,"Not specified Troubleshooting, IPv4, network model, Domain Name System (DNS) Introduction to computer networks, Network layer, Transport and application layers, Network services, Connecting to the Internet, Troubleshooting and future of networks Information Technology",The bits and bytes of computer networks
